"BYLINE","DATE","DATELINE","HEADLINE","LENGTH","PUBLICATION","SECTION","TITLE"
"Ashley Cowburn","October 30, 2016 Sunday 11:04 AM GMT",,"Brexit: Government reveals it is seeking tariff-free access to EU markets; Shadow Brexit Secretary Keir Starmer responded: 'To learn of this in an interview this morning is the wrong way to prepare for these negotiations'","498 words","The Independent (United Kingdom)","UK POLITICS",
"Ashley Cowburn","October 29, 2016 Saturday 12:51 PM GMT",,"Brexit: Theresa May urged to 'remember her words' after calling for MPs' right to veto European talks in 2007; Former Education Secretary Nicky Morgan told The Independent the Prime Minister's 2007 comments were 'spot on'","498 words","The Independent (United Kingdom)","UK POLITICS",
"JAMES Forsyth","October 22, 2016 Saturday",,"Power of the City will get us fair Brexit","498 words","The Sun (England)","EDITORIAL; Pg. 10",
"BY JASON GROVES, DEPUTY POLITICAL EDITOR","October 21, 2016 Friday",,"TORY ANGER AT REMAINER BENN'S BREXIT ROLE","498 words","DAILY MAIL (London)",,
"Charlie Bayliss","October 24, 2016 Monday 1:07 AM GMT",,"David Davis 'being spied on by ALL 27 EU member states trying to gain Brexit intelligence'","497 words","Express Online",,
"LUCY SCHOLES","October 23, 2016 Sunday",,"TURNING A NEW LEAF; Set in a post-Brexit world, Ali Smith's new novel, the first in a four-part series, is delightfully grounded in down to earth realism, says Lucy Scholes","497 words","The Independent - Daily Edition","FEATURES; Pg. 72",
"Alice Foster","November 1, 2016 Tuesday 6:11 PM GMT",,"Nick Clegg slams Brexiteers for ""ludicrous utopianism"" over post-Brexit trade tariffs","496 words","Express Online",,
"JACK MAIDMENT","October 30, 2016 Sunday 1:58 PM GMT",,"UK continuing with EU budget payments may be brexit requirement - Nick Clegg","496 words","Express Online",,
"Rob Merrick","October 25, 2016 Tuesday 10:42 AM GMT",,"UK's £12bn aid budget could be spent on winning Brexit trade deals instead, Priti Patel suggests; Aid spending should not 'exclude the whole area of trade and trade opportunities', the International Development Secretary said","496 words","The Independent (United Kingdom)","UK POLITICS",
"Simon Johnson","October 27, 2016 Thursday",,"Independence vote a worse economic threat than Brexit, warns report","495 words","The Daily Telegraph (London)","NEWS; Pg. 13",
,"October 24, 2016",,"English, French and the Brexit divide: a job for linguist Boris? [...]","495 words","i-Independent Print Ltd","NEWS; Pg. 14",
,"October 22, 2016",,"Leaders give PM silent treatment for brief late-night speech; BREXIT May accused of 'creating a lot of anger'. By Leo Cendrowicz in Brussels","494 words","i-Independent Print Ltd","NEWS; Pg. 4",
"By Tara Cunningham, Business Reporter","October 27, 2016 Thursday 8:00 AM GMT",,"Pound hits one-week high after data shows UK economy grew by 0.5pc after Brexit vote","4934 words","telegraph.co.uk","BUSINESS",
"By Alan Tovey, Industry Editor","October 25, 2016 Tuesday 4:18 PM GMT",,"Brexit fails to dent demand for cars, says Pendragon","493 words","telegraph.co.uk","BUSINESS",
"Joe Barnes","October 31, 2016 Monday 4:50 PM GMT",,"'Brexit is an optimistic story' International economist positive about fall in pound","492 words","Express Online",,
"Ashley Cowburn","October 26, 2016 Wednesday 1:48 PM GMT",,"Brexit: Access to EU security intelligence 'critical' to fighting terrorism, says one of Britain's most senior policewomen; 'We are all safer because we can work together across Europe and share information which each other - that genuinely is helping to keep citizens of Europe safe'","492 words","The Independent (United Kingdom)","UK POLITICS",
"Lana Clements","October 31, 2016 Monday 4:21 PM GMT",,"Eurozone economy grows just 0.3% in Q3 showing EU hit WORSE than UK by Brexit","491 words","Express Online",,
"Oli Smith","October 23, 2016 Sunday 12:01 AM GMT",,"Chief Remoaner MP insists Parliament WILL HAVE final say on Brexit negotiation stance","491 words","Express Online",,
,"October 25, 2016",,"Microsoft prices up due to Brexit; The Business Matrix The day at a glance TECHNOLOGY","49 words","i-Independent Print Ltd","BUSINESS; Pg. 42",
"JOE WATTS AND ROB MERRICK","October 22, 2016 Saturday",,"May sidelined at her own EU Brexit showdown; * PM kept waiting until 1am to make five-minute speech * Cabinet minister warns Lords: don't stand in way of our deal","49 words","The Independent - Daily Edition","NEWS; Pg. 1",
"Cyrus Engineer","October 24, 2016 Monday 11:50 AM GMT",,"'The harder the Brexit the BETTER' Leave voter brands EU 'not fit for purpose'","489 words","Express Online",,
"Zoe Efstathiou","October 31, 2016 Monday 12:22 AM GMT",,"Brexit will 'allow British fishermen to TAKE BACK their waters', says fisheries minister","488 words","Express Online",,
"Rebecca Flood","October 27, 2016 Thursday 10:35 PM GMT",,"EasyJet boss says special aviation deal between UK and EU can be worked out post-Brexit","488 words","Express Online",,
"Lizzie Stromme","October 23, 2016 Sunday 3:03 PM GMT",,"Brexit IS HAPPENING: Sturgeon's dream of second referendum blasted as economic vandalism","488 words","Express Online",,
"JOE WATTS POLITICAL EDITOR","October 20, 2016 Thursday",,"Brexit Cabinet battle looms as Hammond splits with May over foreign students","487 words","The Independent - Daily Edition","NEWS; Pg. 5",
"Joe Barnes","November 1, 2016 Tuesday 7:55 PM GMT",,"Alastair Campbell slams Theresa May's hiring of 'THREE CLOWNS' to negotiate Brexit","486 words","Express Online",,
"SIMON OSBORNE","October 28, 2016 Friday 9:25 AM GMT",,"UK facing battle to scrap freedom of movement as Romanian to be EU chief during Brexit","484 words","Express Online",,
"By Mikey Smith","October 30, 2016 Sunday 11:30 AM GMT",,"Here's what the Government promised Nissan to get them to stay in the UK after Brexit; Labour has demanded the government publish the letter offering assurances to the car manufacturer to convince them to keep their plant in Sunderland. Here's what they say was in it","483 words","mirror.co.uk","NEWS,UK NEWS",
"Lorne Cook","October 30, 2016 Sunday 11:39 AM GMT",,"EU trade deal that highlights dangers of Brexit to be signed within hours","481 words","The Independent (United Kingdom)","MIDDLE EAST",
"Brian Carey","October 30, 2016 Sunday",,"Brexit to put brake on car sales; The forecast for the forecourts is of dipping consumer confidence in wake of British vote, writes Brian Carey","481 words","The Sunday Times (London)","BUSINESS; Pg. 3",
"Michael Deacon","October 28, 2016 Friday",,"Hungry McDonnell makes dog's breakfast of his Brexit speech","481 words","The Daily Telegraph (London)","NEWS; Pg. 2",
"Zlata Rodionova","November 1, 2016 Tuesday 8:10 AM GMT",,"Brexit: Japanese companies have already 'begun receiving offers to relocate elsewhere in the EU'; The warning comes as Business secretary Greg Clark is still resisting calls to publish a letter he wrote to Nissan to persuade them to stay in the UK","480 words","The Independent (United Kingdom)","BUSINESS NEWS",
"By Mikey Smith","October 30, 2016 Sunday 11:30 AM GMT",,"Here's what the Government promised Nissan to get them to stay in the UK after Brexit; Labour has demanded the government publish the letter offering assurances to the car manufacturer to convince them to keep their plant in Sunderland. Here's what they say was in it","480 words","mirror.co.uk","NEWS,UK NEWS",
"John Ingham","October 24, 2016 Monday 12:00 AM GMT",,"'Best of British' Red Arrows fly into China for Brexit sales push","480 words","Express Online",,
"RHODRI PHILLIPS","October 20, 2016 Thursday",,"Bricks 'hit by Brexit'; CITY Sun TRAVIS PERKINS BLAMES 'UNCERTAINTY' AS IT SHUTS STORES","480 words","The Sun (England)","BUSINESS; OPINION COLUMNS; Pg. 43",
"TARA CUNNINGHAM","October 26, 2016 Wednesday",,"Stamp duty and Brexit hit Countrywide","479 words","The Daily Telegraph (London)","BUSINESS; Pg. 7",
"Michael Savage ;Philip Aldrick","October 26, 2016 Wednesday",,"Brexit is blamed for £84bn black hole in public finances","479 words","The Times (London)","NEWS; Pg. 2",
"Zlata Rodionova","October 24, 2016 Monday 11:47 AM GMT",,"Brexit: UK real estate investor looks to snap up European offices to capitalise on looming bank exodus; Property investors are looking foroffice spaces the banks may need after the UK leaves the EU","479 words","The Independent (United Kingdom)","BUSINESS NEWS",
"Sean Farrell","November 1, 2016 Tuesday 11:28 AM GMT",,"Mark Carney's critics must let him do his job, says Virgin Money chief; Jayne-Anne Gadhia says with Bank governor's future now settled he should be left to help steer the UK through Brexit","478 words","The Guardian","BUSINESS",
"Ajay Nair","October 21, 2016 Friday 12:33 PM GMT",,"'You cannot have your cake and eat it!' Belgian MEP blasts Theresa May over Brexit deal","478 words","Express Online",,
"EPHRAIM HARDCASTLE FOR THE DAILY MAIL","October 25, 2016 Tuesday 1:23 AM GMT",,"EPHRAIM HARDCASTLE: Leadership fallout between Brexit buddies Boris Johnson and Michael Gove is to be turned into a Radio 4 Drama","477 words","MailOnline","RIGHTMINDS",
"Caroline Wheeler","October 23, 2016",,"'Remoaner' BBC ordered to stop booing brexit","477 words","Sunday Express","NEWS; Pg. 10",
"BY SIMON WALTERS","October 30, 2016 Sunday",,"THE GREAT BREXIT CUPPA CALAMITY","476 words","MAIL ON SUNDAY (London)",,
"ROB MERRICK DEPUTY POLITICAL EDITOR","October 27, 2016 Thursday",,"Brexit dissent is frustrating the will of Britons, says PM","476 words","The Independent - Daily Edition","NEWS; Pg. 4",
"Greg Heffer, Political Reporter","October 20, 2016 Thursday 1:04 PM GMT",,"Minister suggests Sturgeon could be handed own immigration powers after Brexit","476 words","Express Online",,
"Charlie Peat","November 1, 2016 Tuesday 4:14 AM GMT",,"'We MUST have our voice heard' Now British Virgin Islands DEMANDS input on Brexit talks","475 words","Express Online",,
"Caroline Mortimer","October 24, 2016 Monday 6:13 PM GMT",,"Brexit was a 'terrible mistake', says Tory health minister; Lord David Prior says Theresa May should fight for the country to remain in the single market","475 words","The Independent (United Kingdom)","UK POLITICS",
"Charlie Bayliss","October 30, 2016 Sunday 6:15 AM GMT",,"Hard Brexit 'may see Britain more than DOUBLE worth of failing EU agreements' say experts","474 words","Express Online",,
"Rob Merrick","October 26, 2016 Wednesday 6:32 PM GMT",,"Michael Gove lands a new role on the committee overseeing Brexit; The former Justice Secretary is among prominent Tory Leavers who will scrutinise the EU exit strategy","474 words","The Independent (United Kingdom)","UK POLITICS",
"Alan Tovey","October 25, 2016 Tuesday",,"Exports enjoying benefits of weak pound following Brexit result","474 words","The Daily Telegraph (London)","BUSINESS; Pg. 5",
"Joe Barnes","October 21, 2016 Friday 1:01 PM GMT",,"Polish woman who says she's no longer 'wanted' post-Brexit booed by Question Time audience","474 words","Express Online",,
"Vincent Wood","October 26, 2016 Wednesday 12:58 AM GMT",,"May orders Sturgeon NOT to 'undermine' Britain's Brexit deal by putting Scotland first","473 words","Express Online",,
"Joe Barnes","October 27, 2016 Thursday 8:06 AM GMT",,"Bill Gates makes sly dig about Brexit during Westminster charity speech","472 words","Express Online",,
"By Ben Martin","November 1, 2016 Tuesday 8:11 PM GMT",,"Virgin Money brushes aside Brexit vote concerns","471 words","telegraph.co.uk","BUSINESS",
"Zlata Rodionova","October 27, 2016 Thursday 8:50 AM GMT",,"UK GDP growth drops to 0.5% after Brexit; Despite the slowdown, the economy has grown faster than predicted in the gloomier forecasts ahead of June's vote","471 words","The Independent (United Kingdom)","BUSINESS NEWS",
"Fraser Moore","October 23, 2016 Sunday 4:00 AM GMT",,"Brussels to strip Queen of £1million funding amid 'Hard Brexit' row","471 words","Express Online",,
"Joe Barnes","November 1, 2016 Tuesday 9:20 PM GMT",,"'The economy's going great guns' Ex-Vote Leave CEO issues Brexit rallying call","470 words","Express Online",,
"JAMES TAPSFIELD, POLITICAL EDITOR FOR MAILONLINE","October 27, 2016 Thursday 10:58 AM GMT",,"Vote of confidence in post-Brexit Britain: Nissan signals it WILL build new Qashqai model in Sunderland","470 words","MailOnline","NEWS",
"Cyrus Engineer","October 26, 2016 Wednesday 10:04 AM GMT",,"'The whole thing is a DISGRACE' Farage thunders at EU over attempts to delay Brexit","470 words","Express Online",,
"ROB MERRICK DEPUTY POLITICAL EDITOR","October 22, 2016 Saturday",,"Cameron ally warns hard Brexit will be 'stupid Brexit'","470 words","The Independent - Daily Edition","NEWS; Pg. 8",
,"October 28, 2016",,"EasyJet confident of post-Brexit deal; The Business Matrix The day at a glance TRANSPORT","47 words","i-Independent Print Ltd","BUSINESS; Pg. 50",
"Lizzie Stromme","October 23, 2016 Sunday 3:50 PM GMT",,"Farage blasts bullying banks for NOT ACCEPTING Brexit amid threat to pull cash out of UK","469 words","Express Online",,
"By Telegraph View","October 23, 2016 Sunday 6:34 PM GMT",,"MPs must think bold to make Brexit work - and so must Nicola Sturgeon","469 words","telegraph.co.uk","NEWS",
"Joey Millar","October 21, 2016 Friday 6:48 PM GMT",,"'Let Theresa get on with it!' Hungarian PM tells EU to STOP MOANING and ACCEPT Brexit","469 words","Express Online",,
"Joe Watts","October 21, 2016 Friday 1:07 PM GMT",,"House of Lords future at risk if it tries to block Brexit, leading cabinet minister warns; Some peers have suggested they could stand in the way of Brexit legislation","469 words","The Independent (United Kingdom)","UK POLITICS",
"Ian Johnston","October 27, 2016 Thursday 11:27 AM GMT",,"Brexit sees UK drop to new low in global renewable energy league table; The Government's decisions to scrap the Department for Energy and Climate Change and approve a new nuclear power station at Hinkley Point also hit investor confidence in green energy","468 words","The Independent (United Kingdom)","ENVIRONMENT",
"Greg Heffer, Political Reporter","October 26, 2016 Wednesday 6:11 PM GMT",,"Government minister reveals MPs could block Brexit deal INDEFINITELY","468 words","Express Online",,
"By Telegraph Reporters","October 23, 2016 Sunday 5:17 PM GMT",,"Brexit fanatic in three day police stand-off feared to have stockpiled petrol","468 words","telegraph.co.uk","NEWS",
"Zoe Efstathiou","November 1, 2016 Tuesday 10:01 AM GMT",,"Outrage as David Attenborough says British people were NOT WISE enough for Brexit vote","467 words","Express Online",,
"Cyrus Engineer","October 27, 2016 Thursday 2:05 PM GMT",,"STOP MOANING! Sturgeon and SNP told to quit whinging at government over Brexit","467 words","Express Online",,
"ASHLEY COWBURN POLITICAL CORRESPONDENT","October 22, 2016 Saturday",,"May's insistence UK remains central to EU before Brexit angers leaders","467 words","The Independent - Daily Edition","NEWS; Pg. 7",
"By Tara Cunningham, Business Reporter","October 28, 2016 Friday 7:57 AM GMT",,"FTSE 100 turns positive but pound skids back towards $1.21 after Northern Ireland rejects Brexit challenge","4660 words","telegraph.co.uk","BUSINESS",
"Lizzie Stromme","October 31, 2016 Monday 8:59 AM GMT",,"Brexit means NO single market: Farage blasts MPs betrayal of democracy amid EU-exit farce","466 words","Express Online",,
"Ashley Cowburn","October 27, 2016 Thursday 10:32 PM GMT",,"NHS workers should be protected from curbs to free movement of people after Brexit, campaigners demand; Anna Soubry, the former business minister, said it is vital NHS recruitment is not hampered by any new immigration system","466 words","The Independent (United Kingdom)","UK POLITICS",
"HUGO DUNCAN FOR THE DAILY MAIL","October 24, 2016 Monday 8:24 AM GMT",,"Spending boom helps economy grow faster than expected as UK defies post-Brexit predictions","466 words","MailOnline","NEWS",
"By Tara Cunningham, Business Reporter","October 28, 2016 Friday 7:57 AM GMT",,"FTSE 100 falters and pound skids to eight-day low against euro after Northern Ireland rejects Brexit challenge","4652 words","telegraph.co.uk","BUSINESS",
,"October 30, 2016",,"Brexit is on track - and the Remainers' pessimism must not stop it; Letters to the Editor","465 words","The Sunday Telegraph (London)","LETTERS; Pg. 21",
"Michael Deacon","October 25, 2016 Tuesday",,"Ask away about Brexit - just don't expect a reply; Chaos in Calais","465 words","The Daily Telegraph (London)","NEWS; Pg. 4",
"Michael Moore","October 20, 2016 Thursday 1:18 PM GMT",,"BREXIT - Dithering Government could be affecting YOUR broadband speed","465 words","Express Online",,
"Joe Barnes","November 1, 2016 Tuesday 9:20 PM GMT",,"Ukip leadership hopeful Paul Nuttall: Brexit is not responsible for spike in hate crimes","464 words","Express Online",,
"By Ben Riley-Smith, Assistant Political Editor","October 29, 2016 Saturday 8:19 PM GMT",,"Lib Dems turn fight for Richmond into 'Brexit referendum' with dire warnings over economy","464 words","telegraph.co.uk","NEWS",
"Simon Jenkins","October 28, 2016 Friday 10:54 AM GMT",,"Nissan got a sweetheart deal. Under hard Brexit, everyone will want one; Britain has to trade openly with Europe, and vice versa. A soft Brexit is the only way to do that, and avoid a race to the bottom","464 words","The Guardian","OPINION",
"EUROPE By Nigel Morris POLITICAL EDITOR","October 27, 2016",,"Prime Minister accused of Brexit hypocrisy after speech is leaked","463 words","i-Independent Print Ltd","NEWS; Pg. 6",
"Zlata Rodionova","October 24, 2016 Monday 11:47 AM GMT",,"Brexit: UK real estate investor looks to snap up European offices to capitalise on looming bank exodus; Property investors are looking foroffice spaces the banks may need after the UK leaves the EU","462 words","The Independent (United Kingdom)","BUSINESS NEWS",
,"October 23, 2016",,"Everyone will lose out if the EU takes a punitive approach to Brexit; Letters to the Editor","462 words","The Sunday Telegraph (London)","LETTERS; Pg. 17",
"Charlie Bayliss","October 20, 2016 Thursday 6:35 AM GMT",,"Philip Hammond announces 'skilled migrants are STILL WELCOME after Brexit'","462 words","Express Online",,
"Rachael Pells","October 22, 2016 Saturday 10:02 AM GMT",,"Brexit the 'catalyst' universities need to improve, says Russell Group chair; Brexit could be 'the catalyst we all need', says Russell Group chair, Sir David Greenaway","461 words","The Independent (United Kingdom)","EDUCATION NEWS",
"Lynsey Bews","November 1, 2016 Tuesday 7:08 AM GMT",,"Brexit: EU workers 'adding £7.3bn to Scottish economy'; Around one in 20 workers in Scotland come from other EU countries, with patterns of employment 'markedly different'north of the border","460 words","The Independent (United Kingdom)","UK POLITICS",
"Jonathan Lynn","October 31, 2016 Monday 4:54 PM GMT",,"Brexit means Brexit: breakfast doesn't necessarily mean breakfast; What goes best with a fry-up? Red sauce, brown sauce, or thousands of pages of tangled regulations? Yes Minister's co-creator imagines how Brexit will leave Britain's supermarket bosses howling in the aisles","460 words","The Guardian","POLITICS",
"Patrick Christys","October 25, 2016 Tuesday 2:39 PM GMT",,"Canny British officials swerve strict EU laws banning pre-Brexit trade deal with Australia","460 words","Express Online",,
"MATT DATHAN, POLITICAL CORRESPONDENT FOR MAILONLINE","October 25, 2016 Tuesday 5:08 PM GMT",,"France plots to steal our banks: Leading presidential candidate Alain Juppe must change its tax policy to lure London firms worried about Brexit","460 words","MailOnline","NEWS",
"By Jack Blanchard","October 24, 2016 Monday 11:55 PM GMT",,"Nicola Sturgeon slams Theresa May's 'deeply frustrating' Brexit summit as meeting with UK leaders collapses; The Scottish First Minister said the Prime Minister has no plan for leaving the EU","460 words","mirror.co.uk","NEWS,UK NEWS",
"Caroline Mortimer","November 1, 2016 Tuesday 12:36 PM GMT",,"Donald Trump says he'll win the presidential election: 'It will be Brexit times 10'; Polls have cut Hillary Clinton's lead from 4.6 to 2.5 points following a renewed email scandal","458 words","The Independent (United Kingdom)","US ELECTIONS",
"Simon Osborne","October 27, 2016 Thursday 10:46 AM GMT",,"Don't expect Brexit-type surprise for Trump in Presidential race, says Goldman Sachs","458 words","Express Online",,
"Philip Aldrick","October 20, 2016 Thursday",,"Business shrugs off Brexit to create 100,000 new jobs","458 words","The Times (London)","BUSINESS; Pg. 42",
,"October 27, 2016 Thursday 3:45 PM GMT",,"EasyJet boss confident of post-Brexit airspace deal between Britain and EU","456 words","Express Online",,
"Jill Treanor","October 25, 2016 Tuesday 5:51 PM GMT",,"Ireland is 'ideal home' for European banking regulator after Brexit; Dublin enters battle to provide home for authority, currently based in London, and for European Medicines Agency","456 words","The Guardian","BUSINESS",
"MATT DATHAN, POLITICAL CORRESPONDENT FOR MAILONLINE","October 21, 2016 Friday 10:14 AM GMT",,"Polish woman is BOOED by Question Time audience after saying she no longer feels welcome in the UK after Brexit vote","456 words","MailOnline","NEWS",
"Joe Watts","October 27, 2016 Thursday 10:08 AM GMT",,"Brexit: UK must win EU deal by 2019 or face never-ending talks, says Liam Fox; Canada's deal with the EU is floundering after getting bogged down in Belgium's regional administrations","455 words","The Independent (United Kingdom)","UK POLITICS",
"ROB MERRICK DEPUTY POLITICAL EDITOR","October 26, 2016 Wednesday",,"Aid budget could be used to secure new trade deals post-Brexit, Priti Patel says","455 words","The Independent - Daily Edition","NEWS; Pg. 13",
"Rowena Mason Deputy political editor","October 25, 2016 Tuesday 4:54 PM GMT",,"Hammond says highly skilled won't face EU immigration controls; Chancellor goes further than Theresa May in seeking to reassure financial services industry over consequences of Brexit","455 words","The Guardian","POLITICS",
"By Tom Ough","October 31, 2016 Monday 6:00 AM GMT",,"How will Brexit affect Black Friday and Cyber Monday this year?","454 words","telegraph.co.uk","BLACK FRIDAY",
"MATT DATHAN, POLITICAL CORRESPONDENT FOR MAILONLINE","October 25, 2016 Tuesday 12:43 PM GMT",,"Australia RULES OUT starting talks on trade deal with the UK before Brexit but announces plans to make easier for us to get Aussie visas","454 words","MailOnline","NEWS",
,"October 31, 2016 Monday",,"Brexit negotiators cannot afford to ignore the markets on our doorstep; Letters to the Editor","453 words","The Daily Telegraph (London)","LETTERS; Pg. 15",
"Oliver Wright ; Francis Elliott","October 27, 2016 Thursday",,"Tory remainer pays big price for Brexit attacks","453 words","The Times (London)","NEWS; Pg. 6",
"Macer Hall","October 22, 2016 Saturday",,"MAY TELLS EU BOSSES 'GROW UP'; 'Seize the Brexit opportunities'","453 words","The Express","NEWS; Pg. 1,5",
"David Hughes","October 22, 2016 Saturday 1:26 PM GMT",,"Wales must stay in the EU single market after Brexit, Leanne Wood insists; 'There are 200,000 jobs in Wales dependent on trade with Europe,' says Plaid Cymru leader Ms Wood","453 words","The Independent (United Kingdom)","UK POLITICS",
"Alexandra Sims","October 26, 2016 Wednesday 10:17 AM GMT",,"Brexit: Government to review GM crop regulations in preparation for leaving EU; Agriculture minister George Eustice said 'the Government is considering possible future arrangements for the regulation of genetically modified organisms'","452 words","The Independent (United Kingdom)","HOME NEWS",
"BY GERRI PEEV POLITICAL CORRESPONDENT","October 27, 2016 Thursday",,"FRANKENFOOD FARMERS MAY EXPLOIT BREXIT RULE CHANGES","450 words","DAILY MAIL (London)",,
"Indra Warnes","October 27, 2016 Thursday 9:28 AM GMT",,"EU'S 'BROKEN RELATIONSHIP': Chief Brexit negotiator inflames tensions with Tweet","450 words","Express Online",,
"SHAUN CONNOLLY; SAM LISTER","October 25, 2016 Tuesday",,"FRUSTRATING AND CLUELESS; Scottish leader blasts lack of Brexit strategy","450 words","Daily Mirror","NEWS; Pg. 2",
"Zlata Rodionova","October 25, 2016 Tuesday 9:12 AM GMT",,"Brexit: UK's biggest tech CEO says Theresa May's restriction on foreign workers could damage his business; The Government has hinted it is headed for a so-called hard Brexit which means leaving the single market and an end to freedom of movement","450 words","The Independent (United Kingdom)","BUSINESS NEWS",
"Jessica Elgot Political correspondent","October 27, 2016 Thursday 8:02 AM GMT",,"Tories want a Brexit deal for themselves, not the many - John McDonnell; Shadow chancellor to warn that Theresa May's apparent U-turn over Heathrow expansion shows she cannot be trusted to keep Brexit promises","449 words","The Guardian","POLITICS",
"JAMES BURTON FOR THE DAILY MAIL","October 30, 2016 Sunday 6:27 PM GMT",,"Business confidence defies Brexit gloom: Another blow for Project Fear as optimism hits fresh high","447 words","MailOnline","MARKETS",
"Oliver Wright","October 28, 2016 Friday",,"Last-ditch No 10 pledge kept Nissan in Britain; Carmaker will be shielded from Brexit costs","447 words","The Times (London)","NEWS; Pg. 1",
"Michael Savage C","October 26, 2016 Wednesday",,"Brexit will be bad for business, May told bankers before vote","447 words","The Times (London)","NEWS; Pg. 2",
"Jennifer Rankin in Brussels","October 20, 2016 Thursday 1:41 PM GMT",,"May calls on European leaders to stop Russian atrocities in Syria; Prime minister calls for united stance as she arrives for first summit in Brussels and pledges UK strength as a partner post-Brexit","447 words","The Guardian","POLITICS",
"Charlie Bayliss","October 25, 2016 Tuesday 11:42 PM GMT",,"Fury as Tesco boss demands OPEN BORDERS after Brexit to keep constant flow of cheap labour","446 words","Express Online",,
