"BYLINE","DATE","DATELINE","HEADLINE","LENGTH","PUBLICATION","SECTION","TITLE"
"Ben Chapman","October 28, 2016 Friday 8:28 AM GMT",,"Brexit: Confidence in UK's economic future drops rapidly after pound value crash; Respected GfK Consumer Confidence Barometer recordsmeasure of -17 for outlookon thecomingyear","308 words","The Independent (United Kingdom)","BUSINESS NEWS",
"BY NO BYLINE AVAILABLE","October 28, 2016 Friday",,"UK DRUGS GIANT'S £1BILLION BREXIT BONANZA","305 words","DAILY MAIL (London)",,
"Zlata Rodionova","October 27, 2016 Thursday 8:50 AM GMT",,"UK GDP growth drops to 0.5% after Brexit; Fears are mounting that a relatively resilient performance from the economy in the immediate aftermath of the Brexit vote could be short lived","303 words","The Independent (United Kingdom)","BUSINESS NEWS",
"By Ruki Sayid","October 31, 2016 Monday 7:30 PM GMT",,"British farmers celebrate 'Eggs-it' as demand for home produced eggs rockets in wake of Brexit vote; Food firms are taking advantage of the plunging pound and are snapping up supplies of UK eggs after the poor exchange rate sent the cost of imported ingredients up","300 words","mirror.co.uk","NEWS,UK NEWS",
"Tara Cunningham","October 30, 2016",,"UK companies ease up on post-Brexit profit warnings","300 words","The Sunday Telegraph (London)","BUSINESS; Pg. 2",
"Steven Swinford","October 31, 2016 Monday",,"Hammond attacked over growth figures; Road to Brexit","299 words","The Daily Telegraph (London)","NEWS; Pg. 4",
"HARRY COLE","October 31, 2016 Monday",,"UK WILL GET A TARIFFIC DEAL; BREXIT RED TAPE RAP ; Minister unveils EU free trade aim","299 words","The Sun (England)","NEWS; Pg. 2",
"RHODRI PHILLIPS","November 1, 2016 Tuesday",,"Brexit cheers; CITY Sun THE FTSE 100 FELL 42.04 TO 6954.22 EDITED BY RHODRI PHILLIPS Tel: 020 7782 4050 e-mail: rhodri.phillips@the-sun.co.uk £1 BUYS (EURO)1.11, US $1.22. BRENT CRUDE $48.96 ; BRITS' LEISURE SPENDING UP AFTER EU VOTE","295 words","The Sun (England)","BUSINESS; OPINION COLUMNS; Pg. 37",
"TOM NEWTON DUNN","October 22, 2016 Saturday",,"PARLEZ LE BREXIT; EU bid to negotiate in French","294 words","The Sun (England)","NEWS; Pg. 6",
"Ashley Cowburn","October 30, 2016 Sunday 1:12 PM GMT",,"EU and Canada sign long-awaited free trade agreement; Jean Claude Junker said: 'I don't see any relation between what we are signing today and the Brexit issue'","292 words","The Independent (United Kingdom)","UK POLITICS",
"David Maddox","October 24, 2016 Monday 12:00 AM GMT",,"Australian chief executive backs Brexit by moving part of his manufacturing to Britain","292 words","Express Online",,
,"October 31, 2016 Monday",,"EW IS MAYBE WAN KENOBI; STAR WARS ACTOR'S INDY U-TURN ; Brexit sees him lean to a UK split","290 words","The Sun (England)","NEWS; Pg. 2",
"By James Titcomb","October 22, 2016 Saturday 4:00 PM GMT",,"Adobe says 'Brexit did not make us blink' as it expands UK base","290 words","telegraph.co.uk","TECHNOLOGY",
,"October 27, 2016 Thursday",,"Glaxo's Brexit boom GlaxoSmithKline has [...]; IN THE NEWS","29 words","The Times (London)","NEWS; FRONT PAGE; Pg. 1",
,"October 22, 2016",,"Parlez-vous Brexit?","29 words","i-Independent Print Ltd","FEATURES; Pg. 1",
"Rob Virtue","October 20, 2016 Thursday 1:42 PM GMT",,"Tusk tells May: 'EU is BEST company in world - forget Lion's Den - we won't talk Brexit'","288 words","Express Online",,
"TOM NEWTON DUNN","October 20, 2016 Thursday",,"HARD BREXIT HAMMERING; BLAST FROM CHANCELLOR PM's 'cards on show'","288 words","The Sun (England)","NEWS; Pg. 2",
"MATT DATHAN, POLITICAL CORRESPONDENT FOR MAILONLINE","October 30, 2016 Sunday 9:18 AM GMT",,"Call me Lord Farage! Ukip leader could finally enter Parliament as leadership front-runners pledge to secure peerage for 'Mr Brexit'","287 words","MailOnline","NEWS",
"Lucy Tobin","October 25, 2016",,"Fewer firms in distress since vote for Brexit; ECONOMY","287 words","i-Independent Print Ltd","NEWS; Pg. 43",
"TOM NEWTON DUNN","October 25, 2016 Tuesday",,"STOP TAKING THE SNP, NIC; SCOT BREXIT SLAPDOWN ; May's blast for Sturgeon","287 words","The Sun (England)","NEWS; Pg. 2",
"JAMES TAPSFIELD, POLITICAL EDITOR FOR MAILONLINE","October 27, 2016 Thursday 12:45 PM GMT",,"It's back on! EU trade deal with Canada WILL go ahead after Belgians finally agree in positive sign for Brexit talks","286 words","MailOnline","NEWS",
"JON STONE POLITICAL CORRESPONDENT","October 20, 2016 Thursday",,"Hilary Benn elected to chair Brexit Select Committee","286 words","The Independent - Daily Edition","NEWS; Pg. 9",
"By Ben Martin","October 27, 2016 Thursday 2:16 PM GMT",,"Challenger bank TSB says customers undaunted by Brexit","284 words","telegraph.co.uk","BUSINESS",
"By Laura Hughes, Political Correspondent","October 26, 2016 Wednesday 5:09 PM GMT",,"Michael Gove and other senior Leave campaigners elected to sit on powerful new Brexit committee","284 words","telegraph.co.uk","NEWS",
"Matt Payton","October 28, 2016 Friday 12:25 PM GMT",,"French plan to steal business from Brexit Britain undermined by World Bank rating; Despite efforts at economic reform, its position actually dropped one place since last year","283 words","The Independent (United Kingdom)","EUROPE",
"Chris Green","October 24, 2016",,"May must negotiate exit from single market, Farage insists; BREXIT","283 words","i-Independent Print Ltd","NEWS; Pg. 6",
"James Gillespie","October 23, 2016 Sunday",,"Wood: May part of Brexit thuggery","283 words","The Sunday Times (London)","NEWS; Pg. 8",
"Letter from the Political Editor Nigel Morris i@inews.co.uk","October 31, 2016",,"Rebellion stirs at Westminster over May's Brexit secrecy","281 words","i-Independent Print Ltd","FEATURES; Pg. 3",
"Julia Kollewe","October 28, 2016 Friday 8:49 AM GMT",,"BA owner cuts profit forecast after bumpy ride in third quarter; International Airlines Group blames tumbling pound and poor trading for second consecutive decline in performance since Brexit vote","281 words","The Guardian","BUSINESS",
"RHODRI PHILLIPS","October 29, 2016 Saturday",,"APPLE'S 'BREXIT PRICES' EXCUSE; Old Mac up £500","280 words","The Sun (England)","NEWS; Pg. 16",
"Nigel Morris POLITICAL EDITOR","October 25, 2016",,"Tory takes PM to task over silence on Brexit; EUROPE","280 words","i-Independent Print Ltd","NEWS; Pg. 4",
,"October 31, 2016 Monday",,"BREXIT BLOODLETTING!","2781 words","DAILY MAIL (London)",,
"Nigel Morris POLITICAL EDITOR","October 28, 2016",,"Britain's GDP rises by 0.5 per cent after Brexit; ECONOMY","278 words","i-Independent Print Ltd","NEWS; Pg. 5",
"By Julia Bradshaw","October 22, 2016 Saturday 6:00 PM GMT",,"Ministers snub life sciences industry's report on Brexit","276 words","telegraph.co.uk","BUSINESS",
,"October 25, 2016 Tuesday",,"May right to listen to the Celtic voices on Brexit; Letters to the Editor","274 words","The Daily Telegraph (London)","LETTERS; Pg. 17",
"GAIL CAMERON","October 23, 2016 Sunday",,"BLEU MONDAY; LEADERS' BREXIT SHOWDOWN ; May demands 'grown-up' talks with First Ministers","273 words","The Sun (England)","NEWS; Pg. 2",
"Rehema Figueiredo","October 21, 2016 Friday 8:39 AM GMT",,"Brexit means Brexit Theresa May tells EU summit","273 words","Express Online",,
"Ben Chu","October 31, 2016 Monday 10:01 AM GMT",,"Brexit latest: Mortgage approvals perk up in September; There were 62,932 in the month, up from 60,984 in August and higher than the 61,500 City of London analysts had been expecting","272 words","The Independent (United Kingdom)","BUSINESS NEWS",
"HARRY COLE","October 28, 2016 Friday",,"PROJECT CHEER; BREXIT BOOSTS FOR BRITS UK growth defies Project Fear claim","272 words","The Sun (England)","NEWS; Pg. 2",
"SYLVIA POWNALL","October 23, 2016 Sunday",,"Brexit boost as Ireland targets top pharma jobs; Euro Medicines Agency set for move from London","272 words","Daily Mirror","NEWS; Pg. 2",
,"October 28, 2016 Friday",,"Barclays to stay British; DMUULS www.mirror.co.uk FRIDAY 28.10.2016 DAILY MIRROR 41 graham.hiscott@mirror.co.uk @grahamhiscott 020 7293 3030 www.mirror.co.uk/business Edited by GRAHAM HISCOTT CITYDESK ; Boss in remain pledge post-Brexit","271 words","Daily Mirror","FEATURES; OPINION COLUMN; Pg. 41",
"Marcus Leroux; Neil Johnston","October 28, 2016 Friday",,"Swiss engineer blames Brexit for downturn","271 words","The Times (London)","BUSINESS; Pg. 44,45",
"By Stephen Hayward","October 29, 2016 Saturday 5:41 PM GMT",,"Families face Christmas fuel bill hike fuelled by crash in the pound after Brexit; Power giants to pass on increase in costs after EU referendum led to slump in the value of sterling","270 words","mirror.co.uk","NEWS,UK NEWS",
,"October 24, 2016 Monday",,"Sign up now for our Brexit [...]","27 words","The Times (London)","NEWS; Pg. 9",
"Rhiannon Bury ;Ashley Armstrong","November 1, 2016 Tuesday",,"Sorrell warns Brexit doubts will hamper UK growth","269 words","The Daily Telegraph (London)","BUSINESS; Pg. 4",
"Jill Treanor","October 26, 2016 Wednesday 7:36 PM GMT",,"City of London's tallest building to be built despite Brexit vote; After delay over referendum result owners confirm the 278m Pinnacle, or Helter Skelter, at 22 Bishopsgate will go ahead","269 words","The Guardian","UK NEWS",
"Douglas Patient","October 31, 2016 Monday 4:21 PM GMT",,"BREXIT BOOM for British tourism as confidence 'reaches 12-MONTH high'","268 words","Express Online",,
"Joe Watts","October 31, 2016",,"EU citizens living in the UK 'must not be left in limbo'; BREXIT","268 words","i-Independent Print Ltd","NEWS; Pg. 4",
"JAMES TAPSFIELD, POLITICAL EDITOR FOR MAILONLINE","October 27, 2016 Thursday 9:26 AM GMT",,"The UK economy GREW by 0.5% in the three months after historic Brexit vote despite dire Project Fear warnings","268 words","MailOnline","NEWS",
"ALISON LITTLE","October 23, 2016 Sunday 6:26 PM GMT",,"Clean Brexit: £20bn boost predicted for financial sector if Britain leaves single market","268 words","Express Online",,
"Phillip Inman","October 27, 2016 Thursday 9:49 AM GMT",,"UK economy defies Brexit slowdown fears; Official figures reveal solid growth of 0.5%, beating gloomy forecasts","267 words","The Guardian","BUSINESS",
"Ben Chapman","October 24, 2016 Monday 5:37 PM GMT",,"Brexit: ITV to cut 120 jobs as uncertainty hits advertising market; Job losses will take place across all areas of business and amount to 2 per cent of ITV's workforce","266 words","The Independent (United Kingdom)","BUSINESS NEWS",
"CRAIG SIMPSON FOR MAILONLINE","October 22, 2016 Saturday 5:41 PM GMT",,"Primary school blames Brexit as it charges pupils an extra £20 a year for lunches","265 words","MailOnline","NEWS",
"Kate Peters","October 22, 2016 Saturday",,"How chickens, Brexit, late bedtimes and burgers all play a role in Bill Gates's mission to save the world; With $80 billion, Bill Gates is the world's richest man. So how does he spend his money? What makes his life worthwhile? And is his a happy marriage? Mary Riddell spends three months with the Microsoft billionaire to find the answers. Photographs by Kate Peters","2648 words","The Daily Telegraph (London)","TELEGRAPH MAGAZINE;FEATURES; Pg. 20,21,23,24,27",
"By Dan Bloom","October 26, 2016 Wednesday 6:23 PM GMT",,"Michael Gove is BACK! Tory backstabber wins plum seat on Westminster's new Brexit Committee; The MP, who turned from Boris Johnson's leadership No2 to running against him, won a place on Parliament's powerful Brexit Select Committee","263 words","mirror.co.uk","NEWS,UK NEWS",
"Eugene Henderson","October 23, 2016 Sunday 12:01 AM GMT",,"British company strikes rice deal with China among Brexit fears","263 words","Express Online",,
"By Ian Hyland","October 25, 2016 Tuesday 10:00 PM GMT",,"Ben Fogle's A New Life in the Wild should appeal to us all in Brexit Britain; Lynx Vilden has moved to a hut in a forest and has created a life of Stone Age self-sufficiency","262 words","mirror.co.uk","TV,TV REVIEWS",
"Joe Watts","October 28, 2016 Friday 10:32 AM GMT",,"Brexit legal challenge dismissed: Northern Ireland case against EU withdrawal will not be heard","261 words","The Independent (United Kingdom)","UK POLITICS",
,"October 30, 2016 Sunday",,"WHAT BREXIT MEANS FOR YOUR [...]","26 words","The Sunday Times (London)","HOME;FEATURES; FRONT PAGE; TEASERS; Pg. 1",
,"October 28, 2016 Friday 10:32 AM GMT",,"Brexit legal challenge dismissed: Northern Ireland case against EU withdrawal will not be heard","26 words","The Independent (United Kingdom)","UK POLITICS",
,"October 27, 2016 Thursday",,"Glaxo's Brexit boom; IN THE NEWS","26 words","The Times (London)","NEWS; FRONT PAGE; Pg. 1",
"EMMA GLANFIELD, STEPHANIE LINNING FOR MAILONLINE and REBECCA ENGLISH, ROYAL CORRESPONDENT FOR THE DAILY MAIL","November 1, 2016 Tuesday 10:09 AM GMT",,"Brave Queen, 90, battles on with bloodshot eye to throw state banquet for Colombian president and help secure £1billion post-Brexit trade deal","2577 words","MailOnline","NEWS",
"Katherine Griffiths","October 28, 2016 Friday",,"Barclays mulls Europe move after Brexit","257 words","The Times (London)","BUSINESS; Pg. 46",
"Rob Merrick","October 20, 2016",,"There is no going back on Brexit, PM will tell EU; EUROPE","257 words","i-Independent Print Ltd","NEWS; Pg. 4",
"By Laura Hughes, Political Correspondent","October 21, 2016 Friday 8:30 AM GMT",,"Theresa May admits there will be some 'give and take' over Brexit deal as EU's lead negotiator wants divorce talks to be held in French","2554 words","telegraph.co.uk","NEWS",
"By Laura Hughes, Political Correspondent","October 28, 2016 Friday 6:55 AM GMT",,"Theresa May rejects Tony Blair's call for a second referendum to reverse Brexit 'catastrophe', after he calls on Remainers tomobilise","2538 words","telegraph.co.uk","NEWS",
"By Tara Cunningham, Business Reporter","October 27, 2016 Thursday 8:00 AM GMT",,"FTSE 100 turns positive and pound hovers at $1.22 as UK GDP figures to show impact of Brexit vote","2508 words","telegraph.co.uk","BUSINESS",
"Patrick Christys","October 20, 2016 Thursday 4:13 PM GMT",,"Corbyn's BREXIT HIJACK as Labour leader calls for 'alternative summit' with EU leaders","250 words","Express Online",,
"Stephen Hayward","October 30, 2016",,"BREXIT DRIVES UP ENERGY BILLS 5%; Cost of power soars as £ dives after vote £25.60EXPECTED RISE IN BILL PER HOUSEHOLD EXCLUSIVE","249 words","The People","NEWS; Pg. 26",
"JAMES SALMON, JASON GROVES and HUGO DUNCAN FOR THE DAILY MAIL","October 27, 2016 Thursday 9:26 AM GMT",,"Four months on from Brexit, and it's official, the UK is booming! Economy GREW by 0.5% in the three months after historic vote despite dire warnings from Project Fear","2470 words","MailOnline","NEWS",
"Julia Bradshaw","October 23, 2016",,"Ministers snub life sciences industry's report on Brexit","247 words","The Sunday Telegraph (London)","BUSINESS; Pg. 2",
"JAMES TAPSFIELD, POLITICAL EDITOR FOR MAILONLINE and MATT DATHAN, POLITICAL CORRESPONDENT FOR MAILONLINE","October 24, 2016 Monday 9:01 AM GMT",,"'You are driving Scotland over a Brexit cliff!' Furious Nicola Sturgeon slams Theresa May for uncompromising EU stance moments after tense meeting at Downing Street","2456 words","MailOnline","NEWS",
"Joe Watts","October 21, 2016 Friday 4:38 PM GMT",,"George Osborne admits Brexit 'mistakes' and says he is trying to put them right; The ex-Chancellor says he did not 'properly understand' how angry the public were with the establishment","243 words","The Independent (United Kingdom)","UK POLITICS",
"Zoie O'Brien","October 24, 2016 Monday 3:51 PM GMT",,"BREAKING: Theresa May vows to deliver tough Brexit which will NOT damage EU links","242 words","Express Online",,
"Lana Clements","October 21, 2016 Friday 10:40 AM GMT",,"Fears over Kit Kat chocolate price hike amid Brexit pound plunge","242 words","Express Online",,
"Maya Oppenheim","November 1, 2016 Tuesday 4:31 PM GMT",,"Stephen Hawking: Brexit is too complex even for me","241 words","The Independent (United Kingdom)","PEOPLE",
"Matt Payton","October 25, 2016 Tuesday 9:23 AM GMT",,"The Queen is 'set to lose £1 million in farming subsidies' thanks to Brexit; Sandringham Estate in Norfolkprojected tolose £700,000 a year, with the Windsor Castle estate losing a further £300,000","240 words","The Independent (United Kingdom)","HOME NEWS",
"Robyn Vinter","November 1, 2016",,"Pound named world's worst currency amid Brexit fears; STERLING","239 words","i-Independent Print Ltd","NEWS; Pg. 37",
"Laura Hughes","October 24, 2016 Monday",,"Devolved nations to be given 'hotline' to Brexit Secretary","238 words","The Daily Telegraph (London)","NEWS; Pg. 6",
"Ben Martin","October 21, 2016 Friday",,"Brexit will not harm Europe's economy, says German banker","235 words","The Daily Telegraph (London)","BUSINESS; Pg. 3",
"GLEN OWEN POLITICAL CORRESPONDENT FOR THE MAIL ON SUNDAY","October 22, 2016 Saturday 9:46 PM GMT",,"May is told to call off the Brexit 'attack dogs': Top Tories demand an end to the bitter battle with Chancellor Philip Hammond as they warn the UK is headed for a 'dirty' exit from the EU","2338 words","MailOnline","NEWS",
"TIM SCULTHORPE, MAILONLINE DEPUTY POLITICAL EDITOR","November 1, 2016 Tuesday 10:17 AM GMT",,"'I can explain the secrets of the universe - but don't ask me to work out Brexit!' Stephen Hawking warns the PM she faces a galactic challenge","233 words","MailOnline","NEWS",
"Zlata Rodionova","October 21, 2016",,"UK company relocates to Holland due to Brexit fear; SINGLE MARKET","233 words","i-Independent Print Ltd","NEWS; Pg. 48",
"Michael Glackin","October 30, 2016 Sunday",,"Independence 'bigger threat than Brexit'","232 words","The Sunday Times (London)","NEWS; Pg. 13",
"May Bulman","October 26, 2016 Wednesday 2:05 PM GMT",,"PMQs: Jeremy Corbyn makes Brexit joke at Theresa May's expense and even she has to laugh; 'I thought for a moment the Prime Minister was going to say Brexit means Brexit again'","230 words","The Independent (United Kingdom)","UK POLITICS",
"Shehab Khan","October 31, 2016 Monday 9:01 PM GMT",,"Brexit drives up cost of tea by up to 50 per cent; Price ofan 80 kilogram bag of tea increases from£100 to £150","228 words","The Independent (United Kingdom)","HOME NEWS",
"David","October 26, 2016 Wednesday",,"Weak pound exports after hits German Brexit vote","226 words","The Times (London)","BUSINESS; Pg. 40,41",
"BY SIMON WATKINS","October 30, 2016 Sunday",,"US DRUGS GIANT BACKS POST-BREXIT BRITAIN WITH MOVE OF GLOBAL HQ","225 words","MAIL ON SUNDAY (London)",,
"Dominic Walsh","October 21, 2016 Friday",,"Pernod Ricard says drowning Brexit sorrows will cost more","225 words","The Times (London)","BUSINESS; Pg. 43",
"THIS IS MONEY MARKET REPORTERS","October 28, 2016 Friday 8:20 AM GMT",,"FTSE LIVE: Footsie rallies with US stocks seen up ahead of GDP data; sterling weak on Brexit court decision","2240 words","MailOnline","MARKETS",
"DAVID YOUNG","October 24, 2016 Monday",,"FF CHIEF HITS OUT AT 'SHAMBOLIC' BREXIT","224 words","The Sun (England)","NEWS; Pg. 6",
"By Laura Hughes, Political Correspondent","October 21, 2016 Friday 8:30 AM GMT",,"Theresa May admits there will be some 'give and take' over Brexit deal as EU's lead negotiator wants divorce talks to be held in French","2239 words","telegraph.co.uk","NEWS",
"Tom Knowles","October 27, 2016 Thursday",,"Business needs a shot in the arm after Brexit, CBI warns","223 words","The Times (London)","BUSINESS; Pg. 44",
,"October 24, 2016 Monday",,"THE SPIES WHO LOVE - EU; BREXIT ESPIONAGE FEARS ; 27 states snoop on Davis","223 words","The Sun (England)","NEWS; Pg. 2",
"CHRISTOPHER BOOKER","October 30, 2016",,"It's becoming clearer where May stands on Brexit deal","222 words","The Sunday Telegraph (London)","NEWS; Pg. 24",
"SIMON WATKINS FOR THE MAIL ON SUNDAY","October 29, 2016 Saturday 8:04 PM GMT",,"US drugs giant backs post-Brexit Britain with move of global headquarters near Heathrow Airport","222 words","MailOnline","MARKETS",
"Ben Martin","October 28, 2016 Friday",,"Challenger bank TSB banishes Brexit fears","220 words","The Daily Telegraph (London)","BUSINESS; Pg. 4",
"Ashley Cowburn","October 30, 2016 Sunday 1:12 PM GMT",,"EU and Canada sign long-awaited free trade agreement; Jean Claude Junker said: 'I don't see any relation between what we are signing today and the Brexit issue'","219 words","The Independent (United Kingdom)","UK POLITICS",
,"October 23, 2016 Sunday",,"Brexit hastens PR move to Dublin","219 words","The Sunday Times (London)","BUSINESS; Pg. 2",
"Georgie Keate","October 27, 2016 Thursday",,"Demand for post-Brexit fishing quotas","218 words","The Times (London)","NEWS; Pg. 19",
"Rob Merrick","October 20, 2016 Thursday 2:26 PM GMT",,"Brexit: Alex Salmond slams Government for allowing foreign bankers to stay in UK but not other EU nationals; The former SNP leader condemned Government plans to give workers in financial services a special deal","214 words","The Independent (United Kingdom)","UK POLITICS",
"Zlata Rodionova","October 27, 2016 Thursday 10:50 AM GMT",,"Nissan to build new models in Sunderland and secure 7000 jobs despite Brexit vote; The decision will secure 7,000 jobs","212 words","The Independent (United Kingdom)","BUSINESS NEWS",
"Padraic Flanagan","October 26, 2016",,"Britain divided once again as larger businesses more upbeat about Brexit; CONFIDENCE","212 words","i-Independent Print Ltd","NEWS; Pg. 11",
"ALEX HAWKES FOR THE MAIL ON SUNDAY","October 24, 2016 Monday 11:04 AM GMT",,"London insurance market's £7.4bn EU funds at risk after Brexit","210 words","MailOnline","NEWS",
"Georgie Keate","October 24, 2016 Monday",,"Farage's early Brexit call let punters cash in","210 words","The Times (London)","NEWS; Pg. 6",
"By Michael Wilkinson, Political Correspondent","October 26, 2016 Wednesday 7:03 AM GMT",,"Jeremy Corbyn likens Theresa May to Blackadder's Baldrick as he accuses her of 'dithering' over Brexit plans - PMQs live","2098 words","telegraph.co.uk","NEWS",
"Joey Millar","October 31, 2016 Monday 6:05 PM GMT",,"BREAKING: Brexit bashing Mark Carney to step down as Bank of England Governor in 2019","209 words","Express Online",,
"By Mikey Smith","October 27, 2016 Thursday 10:04 AM GMT",,"Brexit uncertainty slows UK economy to 0.5% growth - but it could have been worse; Growth has been stronger than analysts feared, but weaker than it was before the Brexit vote","209 words","mirror.co.uk","NEWS,UK NEWS",
"Robert Miller","October 25, 2016 Tuesday",,"Microsoft to raise prices after Brexit","208 words","The Times (London)","BUSINESS; Pg. 40",
"TOM NEWTON DUNN","October 21, 2016 Friday",,"LE BRUSS OFF; MAY SUMMIT SHOWDOWN ; EU leaders play hardball on Brexit","207 words","The Sun (England)","NEWS; Pg. 2",
,"October 31, 2016 Monday",,"UK must press for a hard Brexit as soon as possible; THE NORTHERN & SHELL BUILDING NUMBER 10 LOWER THAMES STREET, LONDON EC3R 6EN Tel: 020 8612 7000 (outside UK: +44 20 8612 7000)","202 words","The Express","Pg. 12",
"GARY MENEELY","October 31, 2016 Monday",,"FOSTER STEPS IN BREXIT; Monday, October 31, 20161UM ARLENE'S UNDER FIRE ; Dancing DUP boss' border plan 'fantasy'","202 words","The Sun (England)","NEWS; Pg. 2",
"JAMES TAPSFIELD, POLITICAL EDITOR FOR MAILONLINE and MATT DATHAN, POLITICAL CORRESPONDENT FOR MAILONLINE","October 24, 2016 Monday 9:01 AM GMT",,"'You're driving Scotland over a Brexit cliff!' Furious Nicola Sturgeon demands Theresa May think again after Prime Minister dismisses call for Scotland to have separate trade deal","1999 words","MailOnline","NEWS",
"By Tara Cunningham, Business Reporter","October 27, 2016 Thursday 8:00 AM GMT",,"FTSE 100 falters and pound hovers at $1.22 as UK GDP figures to show impact of Brexit vote","1980 words","telegraph.co.uk","BUSINESS",
"MICHAEL McHUGH","October 29, 2016 Saturday",,"NI Brexit legal bid rejected by courts","195 words","The Sun (England)","NEWS; Pg. 2",
,"October 27, 2016 Thursday",,"'BREXIT IS BIGGEST THREAT & COULD CUT TRADE BY 20%'","195 words","Daily Mirror","NEWS; Pg. 7",
"TOM NEWTON DUNN","October 25, 2016 Tuesday",,"BORDER PLEDGE; BREXIT","195 words","The Sun (England)","NEWS; Pg. 1,2",
"JOHN JEFFAY","November 1, 2016 Tuesday",,"MY BOY JOY AT BREXIT; Geoff's EU lost lad lead","193 words","The Sun (England)","NEWS; Pg. 16",
"By Ben Martin","October 23, 2016 Sunday 11:01 PM GMT",,"EU exporters have more to lose than the UK from tariffs after Brexit","193 words","telegraph.co.uk","BUSINESS",
"JAMES TAPSFIELD, POLITICAL EDITOR FOR MAILONLINE and MATT DATHAN, POLITICAL CORRESPONDENT FOR MAILONLINE","October 21, 2016 Friday 10:33 AM GMT",,"Defiant Theresa May demands 'mature' and 'constructive' Brexit talks from EU leaders after stormy summit in Brussels","1912 words","MailOnline","NEWS",
,"October 26, 2016 Wednesday",,"Post-Brexit, we can make foreign aid work for the UK; THE NORTHERN & SHELL BUILDING NUMBER 10 LOWER THAMES STREET, LONDON EC3R 6EN Tel: 020 8612 7000 (outside UK: +44 20 8612 7000)","191 words","The Express","Pg. 12",
"By Voice of the Mirror","October 28, 2016 Friday 10:45 PM GMT",,"There can be no more Brexit secrets - we need to be able to scrutinise Theresa May's Cabinet; If the Prime Minister and her gang were confident of their position, they would reveal what Nissan bosses were promised to keep them in Sunderland","188 words","mirror.co.uk","NEWS,UK NEWS",
"Joe Watts","October 20, 2016",,"Hammond set for Brexit battle with Prime Minister; IMMIGRATION","186 words","i-Independent Print Ltd","NEWS; Pg. 4",
"MICHAEL McHUGH","October 30, 2016 Sunday",,"Northern leader in Brexit jibe on South","185 words","The Sun (England)","NEWS; Pg. 6",
"Sarah Marsh and Guardian readers","November 1, 2016 Tuesday 1:57 PM GMT",,"'My granddaughter loses sleep over terrorism': children's fears over global events; Increasingly children are worrying about world affairs such as Brexit, according to Childline. Here, parents and grandparents discuss their youngsters' fears","1842 words","The Guardian","SOCIETY",
