"BYLINE","DATE","DATELINE","HEADLINE","LENGTH","PUBLICATION","SECTION","TITLE"
"Graham Snowdon","October 25, 2016 Tuesday 3:23 PM GMT",,"Inside the 28 October edition; Revenge of the peshmerga; moving on from Calais; Gibraltar ponders life after Brexit","653 words","The Guardian","NEWS",
"David Hughes, Lucinda Cameron","October 23, 2016 Sunday 12:18 AM GMT",,"Scotland demands to be equal partner in Brexit negotiations; The lead Scottish minister in the process is concerned that the UK is heading for a hard Brexit","652 words","The Independent (United Kingdom)","UK POLITICS",
"By James Quinn","October 23, 2016 Sunday 8:38 AM GMT",,"BBA chief warns some bankers could leave London if City does not get strong Brexit deal","652 words","telegraph.co.uk","BUSINESS",
"Anne Perkins","October 26, 2016 Wednesday 11:45 AM GMT",,"The Goldman Sachs tape shows May is not leading on Brexit, but following; In private comments pre-referendum the prime minister warned companies would relocate if the UK left the EU. So why is she pursuing hard Brexit?","650 words","The Guardian","OPINION",
"BY GERRI PEEV POLITICAL CORRESPONDENT","October 25, 2016 Tuesday",,"AND NO, SCOTS CAN'T HAVE OWN BREXIT DEAL, SAYS NO?10","650 words","DAILY MAIL (London)",,
,"October 25, 2016 Tuesday",,"Sturgeon: No Brexit plan","65 words","Daily Mirror","NEWS; Pg. 2",
,"October 21, 2016 Friday",,"EU tears into PM on Brexit","65 words","Daily Mirror","NEWS; Pg. 2",
"Siobhan McFadyen","October 26, 2016 Wednesday 10:25 AM GMT",,"'Bizarre' Sturgeon DAMAGING Scotland's reputation by Brexit wingeing, blasts top author","649 words","Express Online",,
"Alexandra Sims","October 30, 2016 Sunday 3:47 PM GMT",,"Mark Carney 'may decide this week' if he will quit following barrage of post-Brexit criticism; Mr Carneyis on a five-year contract that expires in 2018 but has an option to extend the job until 2021","648 words","The Independent (United Kingdom)","HOME NEWS",
"Ashley Cowburn","October 30, 2016 Sunday 11:04 AM GMT",,"Brexit: Government reveals it is seeking tariff-free access to EU markets; Shadow Brexit Secretary Keir Starmer responded: 'To learn of this in an interview this morning is the wrong way to prepare for these negotiations'","647 words","The Independent (United Kingdom)","UK POLITICS",
"Andrew Woodcock","October 20, 2016 Thursday 1:59 PM GMT",,"'Inconceivable' MPs should be denied vote on Theresa May's Brexit negotiations, says Hilary Benn; Mr Benn told BBC Radio 4's Today programme,'Parliament will want to take a decision on the final deal'","645 words","The Independent (United Kingdom)","UK POLITICS",
"Tom Martin","October 27, 2016 Thursday 6:15 PM GMT",,"Sturgeon warned to stop 'politicking' over Brexit as Scotland will get no 'special deal'","643 words","Express Online",,
"Ambrose Evans-Pritchard","November 1, 2016 Tuesday",,"Foreign investors pile into UK bonds as Brexit fears retreat; Eurozone growth stutters amid fall-out from EU vote","642 words","The Daily Telegraph (London)","BUSINESS; Pg. 1,5",
"JAMES TAPSFIELD, POLITICAL EDITOR FOR MAILONLINE","October 27, 2016 Thursday 1:51 PM GMT",,"'We're hurtling towards a chaotic breakfast!' Labour's John McDonnell is ridiculed after confusing 'breakfast' and 'Brexit' THREE TIMES in toe-curling speech","642 words","MailOnline","NEWS",
"SARAH DAVIDSON FOR THISISMONEY.CO.UK","October 26, 2016 Wednesday 9:58 AM GMT",,"Mortgage approvals slump 15% in September as homeowners sit tight to watch Brexit fallout before moving","641 words","MailOnline","MORTGAGES & HOME",
"JOE WATTS POLITICAL EDITOR","October 25, 2016 Tuesday",,"Brexit talks were deeply frustrating, Sturgeon says","640 words","The Independent - Daily Edition","NEWS; Pg. 7",
"JEREMY WARNER","October 23, 2016",,"Calm down. We don't need a negotiating stance on Brexit","640 words","The Sunday Telegraph (London)","BUSINESS; Pg. 2",
,"October 25, 2016 Tuesday",,"BREXIT TECH HIT","64 words","The Sun (England)","NEWS; Pg. 6",
"Joe Barnes, Exclusive","October 29, 2016 Saturday 1:15 PM GMT",,"Farage was RIGHT to brand Clegg and Miliband 'quislings' over battle to stop Brexit","639 words","Express Online",,
"Alix Culbertson","October 29, 2016 Saturday 9:19 PM GMT",,"Germany should use BREXIT to renegotiate terms of 'overbearing' EU, top economist urges","637 words","Express Online",,
"JON STONE POLITICAL CORRESPONDENT","October 25, 2016 Tuesday",,"Senior Tory Andrew Tyrie chides May's Brexit secrecy","636 words","The Independent - Daily Edition","NEWS; Pg. 6",
"Ben Chapman","November 1, 2016 Tuesday 1:02 PM GMT",,"Cost of 'Hard Brexit' increases as UK financial services post record £68bn surplus; Country more reliant on the City than everas nation edges towards break from single market with no 'special treatment' for banks","635 words","The Independent (United Kingdom)","BUSINESS NEWS",
"John Crace","October 31, 2016 Monday 8:22 PM GMT",,"Westminster's Leonard Cohen croons his way into trouble; Considering his government won't be giving a running commentary on Brexit, Greg Clark has an awful lot to say","635 words","The Guardian","POLITICS",
"ZLATA RODIONOVA","October 28, 2016 Friday",,"GDP figures are better than expected but Brexit hasn't happened yet, experts warn","634 words","The Independent - Daily Edition","NEWS; Pg. 10",
"By Tim Wallace and Alan Tovey and Kate McCann, Senior Political Correspondent","October 27, 2016 Thursday 11:20 AM GMT",,"Nissan row as government denies 'secret deal' to support Sunderland factory post-Brexit","634 words","telegraph.co.uk","BUSINESS",
,"October 22, 2016 Saturday",,"Brexit Blur; Theresa May and her EU counterparts are far apart in views about future relations. Britain's justified scepticism of integration must not lead it to overplay its hand","633 words","The Times (London)","EDITORIAL; OPINION; LEADING ARTICLES; Pg. 31",
"Jill Treanor","October 28, 2016 Friday 12:24 PM GMT",,"Sadiq Khan warns hard Brexit will cost millions of jobs across UK; London mayor tells City of London banquet that leaving single market is economic self-sabotage as policy chief admits job losses inevitable","632 words","The Guardian","BUSINESS",
"Rehema Figueiredo","October 31, 2016 Monday 12:00 AM GMT",,"'This is causing uncertainty' Tory rift as leading backbencher attacks Brexit secrecy","631 words","Express Online",,
"Rob Merrick","October 24, 2016 Monday 12:01 AM GMT",,"Theresa May facing a 'constitutional crisis' if UK nations fall out over Brexit, researchers warn; The Institute for Government says it may be legally possiblefor Westminster to impose a settlement -but it would be 'a reckless strategy'","631 words","The Independent (United Kingdom)","UK POLITICS",
"MARK SHAPLAND FOR THIS IS MONEY","October 31, 2016 Monday 10:58 AM GMT",,"WPP to focus on Continental Europe as boss Sir Martin Sorrell warns Brexit anxiety could prompt UK slowdown","629 words","MailOnline","MARKETS",
"Neela Debnath","October 27, 2016 Thursday 12:01 AM GMT",,"The Apprentice: Claude Littnerwarns there is 'a lot to be concerned about' by Brexit","629 words","Express Online",,
"MATT DATHAN, POLITICAL CORRESPONDENT FOR MAILONLINE","October 26, 2016 Wednesday 7:02 PM GMT",,"Leader of the Vote Leave campaign Michael Gove will scrutinise Theresa May's Brexit strategy on committee controlled by Remain MPs","629 words","MailOnline","NEWS",
"Rob Merrick","November 1, 2016 Tuesday 8:01 PM GMT",,"Theresa May has decided to opt into EU crime-fighting measures, risking anger of Brexit Tory MPs; Exclusive: Britain will agree to the automatic sharing of DNA samples, fingerprints and vehicle registration data, after months of uncertainty","628 words","The Independent (United Kingdom)","UK POLITICS",
"JAMES DUNN FOR MAILONLINE","October 31, 2016 Monday 12:25 AM GMT",,"Now Brexit is blamed for soaring child anxiety! Number of children calling helpline rises by a third as charity blames problems in the Middle East and leaving the EU","628 words","MailOnline","NEWS",
"STEPHANIE LINNING FOR MAILONLINE","October 24, 2016 Monday 11:14 AM GMT",,"Microsoft blames 20% UK price hike on falling pound after Brexit","628 words","MailOnline","NEWS",
"Sean Farrell","October 30, 2016 Sunday 4:50 PM GMT",,"EU and Canada sign Ceta free trade deal; Canadian PM Justin Trudeau flies in to sign controversial treaty in Brussels as alarm in UK mounts over complexities of post-Brexit trade deals","625 words","The Guardian","BUSINESS",
"Ashley Cowburn","October 30, 2016 Sunday 6:40 PM GMT",,"Theresa May's Government 'making up Brexit strategy as it goes along'; John McDonnell told The Independent the Government's position 'puts the UK economy in a position of being hostage to fortune rather than deciding its own destiny'","625 words","The Independent (United Kingdom)","UK POLITICS",
"Julia Bradshaw","October 20, 2016 Thursday",,"Pressures that lurk behind full employment; Analysis ; Slower jobs growth, rising prices eroding pay, and Brexit concerns all pose a threat, says Julia Bradshaw","624 words","The Daily Telegraph (London)","BUSINESS; Pg. 4",
"Alan Cochrane","October 20, 2016 Thursday",,"Sturgeon's playing for time, but the Tories need to change their tune; The Government's 'Hard Brexit' rhetoric will only serve to strengthen the First Minister's hand","623 words","The Daily Telegraph (London)","NEWS; Pg. 5",
"Nick Gutteridge","October 20, 2016 Thursday 10:49 AM GMT",,"MOMENT OF TRUTH: We're now so divided Brexit deal may be IMPOSSIBLE admits EU trade chief","623 words","Express Online",,
"Phillip Inman Economics correspondent","October 26, 2016 Wednesday 12:01 AM GMT",,"Philip Hammond could face £80bn black hole following Brexit vote; Short-term hit to economy will push leave Treasury with shortfall over next five years, warns thinktank","622 words","The Guardian","POLITICS",
"Rowena Mason Deputy political editor","October 31, 2016 Monday 7:43 PM GMT",,"Nissan assurances over Brexit cannot be published, says business secretary; Greg Clark says commercial sensitivity prevents him from meeting MPs' demands to 'show us the letter'","621 words","The Guardian","POLITICS",
"James Moore","October 25, 2016 Tuesday 11:34 AM GMT",,"Hornby's prices are chugging higher as Brexit obstructs the tracks; The toymakeris a unique company but its business model is notand it won't be alone in having tohike prices as a result of the pound's tumble","620 words","The Independent (United Kingdom)","NEWS",
,"October 20, 2016 Thursday",,"Brexit-watch job for Benn","62 words","Daily Mirror","NEWS; Pg. 2",
,"October 29, 2016 Saturday",,"Sovereignty and Scrutiny; Theresa May once wrote a plan for MPs to hold government to account in European negotiations. It is a good principle for Brexit","619 words","The Times (London)","EDITORIAL; OPINION; LEADING ARTICLES; Pg. 29",
"JAMES TAPSFIELD, POLITICAL EDITOR FOR MAILONLINE","October 27, 2016 Thursday 9:26 AM GMT",,"So much for Project Fear! The UK economy GREW by 0.5% in the three months after historic Brexit vote despite Osborne's dire warnings","619 words","MailOnline","NEWS",
"Mike Wade","October 25, 2016 Tuesday",,"Brexit bound to be awful for universities, warns principal","619 words","The Times (London)","NEWS; Pg. 16",
"JOE WATTS","October 29, 2016 Saturday",,"No 10 rejects Blair's call for second Brexit vote, saying he speaks only 'for himself'","616 words","The Independent - Daily Edition","NEWS; Pg. 5",
"Peter Dominiczak;Tim Wallace;Steven Swinford","November 1, 2016 Tuesday",,"Carney to quit straight after Brexit; Bank Governor will stay at helm through EU talks but won't serve full term","615 words","The Daily Telegraph (London)","NEWS; Pg. 1",
"Alex Hern","October 28, 2016 Friday 10:05 AM GMT",,"Brexit hits Apple Mac customers hard as prices rise by up to £500; New laptops significantly more expensive and already-existing machines have prices raised by hundreds of pounds as Apple adjusts for new US dollar-pound sterling rate","615 words","The Guardian","TECHNOLOGY",
"HAMISH MCRAE","October 20, 2016 Thursday",,"Forget Brexit - this is what will happen to the world economy if Trump wins","615 words","The Independent - Daily Edition","COMMENT; Pg. 32",
"MATT DATHAN, POLITICAL CORRESPONDENT FOR MAILONLINE","October 30, 2016 Sunday 9:18 AM GMT",,"Call me Lord Farage! Ukip leader could finally enter Parliament as leadership front-runners pledge to secure peerage for 'Mr Brexit'","614 words","MailOnline","NEWS",
"Adam Withnall","October 27, 2016 Thursday 9:59 AM GMT",,"'Sprich kein Deutsch': Germans fear for place in post-Brexit Britain; German mother who has lived in London for 13 years says she no longer feels safe speaking her native language in public","613 words","The Independent (United Kingdom)","HOME NEWS",
"Philip Aldrick","October 27, 2016 Thursday",,"Bonus from Brexit is worth £1bn, says Glaxo; Drugmaker's turnover lifted by weaker pound","613 words","The Times (London)","BUSINESS; Pg. 43",
"Sean O'Grady","November 1, 2016 Tuesday 5:22 PM GMT",,"What would a Donald Trump victory mean for post-Brexit Britain?; The Donald'sattitude to the US Federal Reserveis hostile. How this might pan out is anybody's guess -but a threat to the stability of the dollar could destabilise the entire world economy","612 words","The Independent (United Kingdom)","VOICES",
"Simon Johnson","October 31, 2016 Monday",,"Separation will be worse than Brexit for financial industry; Financial services 'depend more on the UK than EU'","612 words","The Daily Telegraph (London)","NEWS; Pg. 1,2",
"SIMON WALTERS, POLITICAL EDITOR FOR THE MAIL ON SUNDAY","October 29, 2016 Saturday 9:28 PM GMT",,"The great Brexit cuppa calamity: UK boss of Typhoo Tea warns of the 'disastrous' impact of Leave vote - as the price of imports leaps by a scalding 50%","612 words","MailOnline","NEWS",
"James Dean","October 26, 2016 Wednesday",,"Thousands of Vauxhall jobs at risk from Brexit; Carmaker warns of plant closures after $400m hit","612 words","The Times (London)","BUSINESS; Pg. 39",
"Rob Merrick","October 21, 2016 Friday 4:03 PM GMT",,"Brexit row erupts between Theresa May and EU over call for negotiations to be held in French; The European Union's chief negotiator has suggested that English be dropped as the official language to be used during the divorce talks","612 words","The Independent (United Kingdom)","UK POLITICS",
"By Peter Foster , Europe Editor","October 20, 2016 Thursday 8:40 AM GMT",,"Theresa May facing 'critical test' of her sincerity towards Brexit negotiations at EU Council dinner","612 words","telegraph.co.uk","NEWS",
"By Ashley Armstrong and Rhiannon Bury","October 31, 2016 Monday 11:04 AM GMT",,"WPP warns of 'Brexit anxiety' as UK revenues slip","611 words","telegraph.co.uk","BUSINESS",
"By Steven Swinford, Deputy Political Editor and David Chazan","October 30, 2016 Sunday 10:00 PM GMT",,"British fisherman will catch hundreds of thousands of tonnes more fish after Brexit, minister says","611 words","telegraph.co.uk","NEWS",
"By Kate Palmer, Business reporter and Jillian Ambrose","October 21, 2016 Friday 7:33 AM GMT",,"British American Tobacco stuns with $47bn post-Brexit takeover","611 words","telegraph.co.uk","BUSINESS",
"Oli Smith","October 30, 2016 Sunday 2:25 PM GMT",,"Leave chief calls Canadian Bank of England boss Brexit LOSER amid rumours he will quit","610 words","Express Online",,
"MARTIN ROBINSON, UK CHIEF REPORTER FOR MAILONLINE","October 28, 2016 Friday 2:40 PM GMT",,"Morrisons caves in to pressure from Marmite-maker Unilever and hikes the cost of the spread by 30p-a-jar after the firm's Brexit price row with Tesco","610 words","MailOnline","NEWS",
,"November 1, 2016 Tuesday",,"SO what does 'Brexit means [...]","61 words","Daily Mirror","SPORT; OPINION COLUMNS; Pg. 53",
"Nigel Morris POLITICAL EDITOR","October 31, 2016",,"Business Secretary under fire for revealing Brexit strategy on TV; POLITICS","609 words","i-Independent Print Ltd","NEWS; Pg. 4",
"DANIEL MARTIN CHIEF POLITICAL CORRESPONDENT FOR THE DAILY MAIL","October 25, 2016 Tuesday 10:52 PM GMT",,"'Companies will quit Britain if we vote to leave the EU': Leaked tape of Theresa May talking to bankers before the referendum reveals what the PM REALLY thinks of Brexit","607 words","MailOnline","NEWS",
,"October 22, 2016 Saturday",,"Davis tells Sturgeon: No special deal for you in Brexit talks","607 words","The Times (London)","NEWS; Pg. 9",
"FIONA PARKER","October 31, 2016 Monday",,"Brexit car crash or clear road ahead?","606 words","Daily Mirror","FEATURES; Pg. 40",
"Sarah Butler","November 1, 2016 Tuesday 8:25 PM GMT",,"Legally protected UK food products under Brexit threat, says Nick Clegg; Lib Dem spokesman warns EU businesses could make imitations of regionally designated foodstuffs such as Melton Mowbray pork pies and stilton","605 words","The Guardian","POLITICS",
"Ishaan Tharoor","November 1, 2016 Tuesday 12:25 PM GMT",,"Because of Brexit, British Jews whose families once fled the Nazis are applying for German passports; In August, the German Embassy in London confirmed it had received over 400 inquiries regarding citizenship in the seven weeks following the EU referendum","605 words","The Independent (United Kingdom)","HOME NEWS",
"By Gemma Mullin","October 29, 2016 Saturday 11:39 AM GMT",,"British Airways and Apple prices to rise while free gym towel services BANNED after post-Brexit pound slump; British Airways has warned prices could rise after its profits took a hit while MacBook Pro's are up to £500 more expensive in the wake of Brexit","605 words","mirror.co.uk","NEWS,UK NEWS",
"Ashley Cowburn","October 29, 2016 Saturday 10:07 PM GMT",,"Brexit: John McDonnell demands Government offers Nissan assurances to entire manufacturing sector; 'We cannot have a situation where the government are simply going factory-by-factory'","604 words","The Independent (United Kingdom)","UK POLITICS",
"SABAH MEDDINGS FOR THE DAILY MAIL","October 27, 2016 Thursday 8:24 PM GMT",,"Plug pulled on £15bn of London deals: O2 and Misys axe plans to join stock marketas investors fret about Brexit","604 words","MailOnline","MARKETS",
"By Mikey Smith","October 27, 2016 Thursday 12:23 PM GMT",,"Brexit means Breakfast: John McDonnell fumbles words as he warns Tories want to make UK a tax haven; The Shadow Chancellor confused leaving the EU with a morning meal three times","604 words","mirror.co.uk","NEWS,UK NEWS",
,"October 26, 2016 Wednesday",,"Heathrow expansion and the link to Brexit; Letters to the Editor","604 words","The Times (London)","LETTERS; Pg. 30",
"Zlata Rodionova","October 20, 2016 Thursday 3:05 PM GMT",,"Brexit: British company moves HQ to Europe after 122 years of trading in UK, says it 'can't afford to wait' for Article 50; Another concern for the company is the uncertainty surrounding its workforce as it employs over a dozen European staff","604 words","The Independent (United Kingdom)","BUSINESS NEWS",
"Editorial","October 20, 2016 Thursday 12:23 AM GMT",,"A parliamentary vote at the end of the Brexit talks is not good enough; A range of MPs and peers are preparing to hold the Government to account as it negotiates to leave the European Union","604 words","The Independent (United Kingdom)","EDITORIALS",
"Zlata Rodionova","October 20, 2016 Thursday 3:05 PM GMT",,"Brexit: British company moves to Europe after 122 years of trading in UK, says it 'can't afford to wait' for Article 50; Another concern for the company is the uncertainty surrounding its workforce as it employs over a dozen European staff","603 words","The Independent (United Kingdom)","BUSINESS NEWS",
"MATT DATHAN, POLITICAL CORRESPONDENT FOR MAILONLINE","October 28, 2016 Friday 1:19 PM GMT",,"'Voters might change their mind!' Tony Blair lays out his plans to hold a second EU referendum to reverse the Brexit 'catastrophe'","602 words","MailOnline","NEWS",
"Steven Swinford","October 31, 2016 Monday",,"Fishing quotas scrapped after Brexit; Hundreds of thousands of tons more fish can be caught after 'unfair' rules overhauled ; Fishing quotas face post-Brexit overhaul","600 words","The Daily Telegraph (London)","NEWS; Pg. 1,4",
"BY JASON GROVES DEPUTY POLITICAL EDITOR","October 27, 2016 Thursday",,"BREXIT WON'T HARM BRITAIN, ADMITS WORLD TRADE CHIEF","600 words","DAILY MAIL (London)",,
"JAMES TAPSFIELD, POLITICAL EDITOR FOR MAILONLINE","October 26, 2016 Wednesday 4:14 PM GMT",,"Now Baldrick does Brexit! Theresa May is offered help by Blackadder star after Jeremy Corbyn jibes that she needs a 'cunning plan'","600 words","MailOnline","NEWS",
,"October 22, 2016 Saturday",,"MAY AND DAVIS TELL EU OUR POST-BREXIT PLAN","6 words","Daily Mirror","FEATURES; OPINION COLUMN; Pg. 15",
"Zoie O'Brien","October 31, 2016 Monday 8:00 AM GMT",,"Northern Ireland plans to negotiate separate EU trade deal after Brexit","599 words","Express Online",,
"Nick Fletcher","October 28, 2016 Friday 9:40 AM GMT",,"FTSE falls back but Imperial Brands and BAT higher; Lower down the market, Unite falls on fears of Brexit hit to student numbers","599 words","The Guardian","BUSINESS",
"By Steven Swinford, Deputy Political Editor","October 24, 2016 Monday 1:50 PM GMT",,"Theresa May warns Nicola Sturgeon against 'undermining' Brexit as No 10 summit descends into acrimony","598 words","telegraph.co.uk","NEWS",
"By Laura Hughes, Political Correspondent","October 26, 2016 Wednesday 4:18 PM GMT",,"Lib Dem 'Brexit referendum' candidate for Richmond says people must 'accept' referendum vote","597 words","telegraph.co.uk","NEWS",
"Rob Merrick","October 20, 2016 Thursday 12:18 AM GMT",,"Theresa May to tell EU leaders there will be no U-turn on Brexit; At her first European Council summit, the Prime Minister will seek off to kill off chatter that a second referendum 'might be still a possibility'","597 words","The Independent (United Kingdom)","UK POLITICS",
"Vickiie Oliphant","October 25, 2016 Tuesday 3:38 PM GMT",,"Morrissey praises Brexit as 'MAGNIFICENT' and hits out BBC for not accepting result","596 words","Express Online",,
"DAILY MAIL COMMENT","October 31, 2016 Monday 1:08 AM GMT",,"DAILY MAIL COMMENT: Don't blame Brexit for fleecing shoppers","594 words","MailOnline","RIGHTMINDS",
"Zlata Rodionova","October 27, 2016 Thursday 2:35 PM GMT",,"GDP figures are better than expected but Brexit hasn't happened yet, experts point out; Economists are predicting growth will slow in 2017as rising inflation and weak earnings are expected to reduce consumer spending power","594 words","The Independent (United Kingdom)","BUSINESS NEWS",
"JAMES MOORE","October 26, 2016 Wednesday",,"Hornby prices chug higher as Brexit obstructs tracks","594 words","The Independent - Daily Edition","BUSINESS; Pg. 48",
"Rob Merrick","October 27, 2016 Thursday 5:37 PM GMT",,"Brexit: Minister refuses six times to say how Government managed to persuade Nissan to build new cars in Sunderland; Greg Clark, the Business Secretary, is under pressure to reveal the bill to keep foreign carmakers in Britain - after the triumph of the Nissan announcement","591 words","The Independent (United Kingdom)","UK POLITICS",
"Geoff Ho","October 23, 2016 Sunday 12:00 AM GMT",,"First post-Brexit vote figures show economy slowing","591 words","Express Online",,
"Macer Hall","October 21, 2016 Friday 8:37 PM GMT",,"EU summit: Theresa May tells European leaders to 'GROW UP' and accept Brexit","591 words","Express Online",,
"By Jack Blanchard","October 20, 2016 Thursday 9:43 PM GMT",,"EU leaders lay into Britain over Brexit as Theresa May attends her first summit; PM told in no uncertain terms that Britain can not end the free movement of people and maintain access to the single market","590 words","mirror.co.uk","NEWS,UK NEWS",
"Editorial","October 29, 2016 Saturday 5:05 PM GMT",,"Democratic oversight of Brexit is not an attempt to frustrate the will of the British people, Theresa May; Those who are opposed to a hard Brexit need to make sure that they are not painted into the corner of appearing to stand against the referendum result","589 words","The Independent (United Kingdom)","EDITORIALS",
"Rehema Figueiredo","October 28, 2016 Friday 4:00 PM GMT",,"Black Friday binge begins TODAY: Bumper post-Brexit sales expected to rake in BILLIONS","589 words","Express Online",,
"Michael Savage","October 24, 2016 Monday",,"Hard Brexit would cost the EU £8bn a year more than Britain","588 words","The Times (London)","NEWS; Pg. 8,9",
"EDITORIAL","October 30, 2016 Sunday",,"The people should have a say on the terms of Brexit","587 words","The Independent - Daily Edition","NEWS; Pg. 2",
"Cyrus Engineer","October 29, 2016 Saturday 2:47 PM GMT",,"Farage fires back at Blair: Ex-PM's calls to reverse Brexit leaves Ukip chief FURIOUS","585 words","Express Online",,
,"October 22, 2016 Saturday",,"The truth about Brexit is really not that ugly; Letters to the Editor","585 words","The Times (London)","LETTERS; Pg. 30",
"BY HUGO DUNCAN AND JAMES BURTON","October 22, 2016 Saturday",,"SO MUCH FOR BREXIT BLUES: UK TOBACCO GIANT IN £38BN BID TO BUY ITS US RIVAL","584 words","DAILY MAIL (London)",,
"Nick Gutteridge","October 31, 2016 Monday 2:18 PM GMT",,"Even LABOUR'S Brexit chief says EU free movement MUST end in Corbyn revolt","583 words","Express Online",,
"Joe Barnes, exclusive","October 31, 2016 Monday 5:56 PM GMT",,"'An EU federalist of the worst kind' MEP slams Martin Schulz over UK's Brexit treatment","582 words","Express Online",,
"By Tim Wallace","October 22, 2016 Saturday 5:30 PM GMT",,"UK economy to grow even faster this year than was forecast before the Brexit vote","582 words","telegraph.co.uk","BUSINESS",
"Greg Heffer, Political Reporter","October 27, 2016 Thursday 11:49 AM GMT",,"Leading Tory MP calls on Theresa May to end bid to 'micro-manage' Brexit","580 words","Express Online",,
,"November 1, 2016 Tuesday",,"House price growth 'will be subdued by Brexit'; BUSINESS BULLETIN","58 words","The Daily Telegraph (London)","BUSINESS; Pg. 7",
