"BYLINE","DATE","DATELINE","HEADLINE","LENGTH","PUBLICATION","SECTION","TITLE"
"Griff Witte","October 31, 2016 Monday 8:17 AM GMT",,"Donald Trump and Brexit: How similar are they?; 'Im not persuaded, but I'm frightened,"" said King, who, like most Brits, is no fan of Trump. ""You can't utterly discount that possibility."",""1166 words","NA","The Independent (United Kingdom)","US ELECTIONS",
"By Jason Beattie","November 1, 2016 Tuesday 8:46 AM GMT",,"Donald Trump channels Brexit in US presidential race: Mirror Politics morning briefing; The Republican candidate boasts he will put off a victory that will be ""Brexit times ten"",""445 words","NA","mirror.co.uk","NEWS,UK NEWS",
"By Dan Bloom","October 21, 2016 Friday 10:44 AM GMT",,"Britain's former EU chief warns Theresa May not to choose 'Stupid Brexit'; Former EU commissioner Lord Hill made the stark comment today as he told of the ""danger"" Britain's negotiation could ""self-harm"",""343 words","NA","mirror.co.uk","NEWS,UK NEWS",
"Katie Forster","October 20, 2016 Thursday 3:05 PM GMT",,"Brexit: Masculine or feminine? Europe splits over gender of UK's EU withdrawal; European nations are divided over whether to say ""le Brexit","410 words","The Independent (United Kingdom)","EUROPE",
"Letters","October 27, 2016 Thursday 5:18 PM GMT",,"Despite Brexit, the government's support of Nissan will continue to give away tax payers' money to the EU; Please send your letters to letters@independent.co.uk","990 words","The Independent (United Kingdom)","LETTERS",
"MATT DATHAN, POLITICAL CORRESPONDENT FOR MAILONLINE","October 26, 2016 Wednesday 1:13 PM GMT",,"Britain will NOT suffer trade disruption even under a 'hard' Brexit, says World Trade Organisation chief as he vows to help us secure a 'smooth' EU divorce","985 words","MailOnline","NEWS",
"Ross Clark","October 29, 2016 Saturday 7:25 AM GMT",,"The UK economy is soaring in the run-up to Brexit, says Ross Clark","983 words","Express Online",,
"Polly Toynbee","October 27, 2016 Thursday 12:08 PM GMT",,"A vote against Zac Goldsmith is a vote against extreme Brexit; Labour should not contest the Richmond byelection. Instead, it should give the Lib Dems a clear run to beat the constituency's hard Brexit MP","983 words","The Guardian","OPINION",
"Roger Bootle","October 24, 2016 Monday",,"More than Brexit at work in large market movements","981 words","The Daily Telegraph (London)","BUSINESS; Pg. 2",
,"October 21, 2016 Friday",,"May has to give certainty that Brexit is irreversible; Letters","98 words","The Express","LETTERS; Pg. 23",
"Stephen Pollard, Political commentator","October 22, 2016 Saturday 12:01 AM GMT",,"Remoaner MPs are trying to sabotage Brexit negotiation","979 words","Express Online",,
"Patrick Wintour Diplomatic editor","October 30, 2016 Sunday 1:06 PM GMT",,"Greg Clark's big reveal on 'demeanour' of Brexit negotiations strategy; Business secretary's interview on Andrew Marr Show makes it clear UK will adopt sector-by-sector approach in Brexit talks","975 words","The Guardian","POLITICS",
,"October 28, 2016",,"May must acknowledge Brexit risks; The Opinion Matrix COMMENT FROM HOME & ABROAD GOLDMAN SACHS SPEECH","97 words","i-Independent Print Ltd","NEWS; Pg. 14",
"By Michael Wilkinson, Political Correspondent","October 26, 2016 Wednesday 7:03 AM GMT",,"Theresa May will 'make success of Brexit' despite leaked recordings of her expressing doubts","967 words","telegraph.co.uk","NEWS",
"Lana Clements","October 28, 2016 Friday 9:01 AM GMT",,"Stop bad-mouthing Britain! Treasury, Bank of England and IMF Brexit forecasts proved wrong","958 words","Express Online",,
"Angela Monaghan","October 24, 2016 Monday 1:00 PM GMT",,"The Brexit economy: falling pound and rising inflation fuel fears of slowdown; The latest monthly Guardian analysis of a dashboard of data points to the UK economy starting to lose momentum after the EU referendum· Help fund our journalism by becoming a Guardian supporter","956 words","The Guardian","BUSINESS",
"By Ben Riley-Smith, Assistant Political Editor","October 29, 2016 Saturday 8:30 PM GMT",,"Hard Brexit could help secure trade deals worth double EU agreements, say Eurosceptics","954 words","telegraph.co.uk","NEWS",
"Nick Gutteridge","October 24, 2016 Monday 7:30 PM GMT",,"BRUSSELS TO DECIDE ON BREXIT: Warning Euro judges could TAKE CONTROL over Article 50 terms","954 words","Express Online",,
"Alexi Duggins","October 26, 2016 Wednesday 9:00 AM GMT",,"Nigel Farage the sitcom: is Brexit's cheerleader beyond a joke?; A new one-off comedy follows the Ukip poster boy as he swaps politics for watching Pointless and going down the pub. But is it humanising his hatred?","953 words","The Guardian","TELEVISION & RADIO",
"DANIEL MARTIN AND HOLLY BLACK","October 24, 2016 Monday 12:01 AM GMT",,"It's nonsense! Banks dismiss gloom-laden claim they'll quit the UK after Brexit","952 words","MailOnline","NEWS",
,"October 29, 2016",,"Will he fall in the Brexit revolution?; The Opinion Matrix COMMENT FROM HOME & ABROAD THE FATE OF MARK CARNEY","95 words","i-Independent Print Ltd","NEWS; Pg. 16",
,"October 22, 2016",,"Republic may be the key to soft Brexit; The Opinion Matrix COMMENT FROM HOME & ABROAD IRELAND'S EU DEAL","95 words","i-Independent Print Ltd","NEWS; Pg. 16",
"KEILIGH BAKER FOR MAILONLINE","October 21, 2016 Friday 9:18 AM GMT",,"Have a break, have a Brexit! Swiss firm Nestle threatens to raise the price of a Kit Kat and other family favourites because the plunging pound is hitting profits","944 words","MailOnline","NEWS",
"James Quinn","October 25, 2016 Tuesday",,"Banks are here to stay, whatever the Brexit deal","943 words","The Daily Telegraph (London)","BUSINESS; Pg. 2",
"By Nick Allen","November 1, 2016 Tuesday 3:31 AM GMT",,"Donald Trump launches full-frontal assault on safe Democratic states promising 'Brexit times 10'","939 words","telegraph.co.uk","NEWS",
"Victoria Coren Mitchell","October 23, 2016 Sunday 12:05 AM GMT",,"Six safe subjects for small talk in a Brexit- and Corbyn-torn world; Conversation has turned toxic in our bitterly divided land. Here's my survival guide...","938 words","The Observer (London)","OPINION",
"By Laura Hughes, Political Correspondent","October 28, 2016 Friday 6:55 AM GMT",,"Minister convinced Nissan to keep building in UK with written promise it would not lose out post-Brexit","935 words","telegraph.co.uk","NEWS",
"ALASTAIR MACDONALD","October 24, 2016 Monday 7:12 AM GMT",,"Still here? British lawmakers say they are being left 'sidelined and isolated' in Brussels after Brexit; 'Why should anyone listen to us?'sayBritish membersof the European Parliament","935 words","The Independent (United Kingdom)","UK POLITICS",
"TONY BLAIR","October 29, 2016 Saturday",,"If Brexit is a disaster we must have right to change our mind; As the pound crashes and firms cut back, ex-PM's plea","934 words","Daily Mirror","EDITORIAL; OPINION; LEADING ARTICLES; Pg. 8",
"DAVID MARTOSKO, US POLITICAL EDITOR FOR DAILYMAIL.COM IN JOHNSTOWN, PENNSYLVANIA","October 21, 2016 Friday 10:45 PM GMT",,"'We will shock the world!' Trump predicts 'Brexit-plus' victory as he blames reporters Clintonworld sees as 'friendly and malleable' for standing in his way","934 words","MailOnline","NEWS",
"By Michael Wilkinson, Political Correspondent","October 24, 2016 Monday 6:39 AM GMT",,"Theresa May offers Brexit olive branch to Nicola Sturgeon but SNP leader insists she wants Remain vote to be respected in Scotland","933 words","telegraph.co.uk","NEWS",
,"November 1, 2016",,"The good news keeps on coming; The Opinion Matrix COMMENT FROM HOME & ABROAD BREXIT PRICES","93 words","i-Independent Print Ltd","FEATURES; Pg. 14",
"EMMA GLANFIELD FOR MAILONLINE","October 25, 2016 Tuesday 1:37 PM GMT",,"Tesco boss warns price of your shopping WILL rise 3% thanks to fall in the pound and loss of migrant workers after Brexit vote","927 words","MailOnline","NEWS",
"ALEXANDRA SIMS AND ASHLEY COWBURN","November 1, 2016 Tuesday",,"Nissan Brexit deal could lead to 'colossal bill for the taxpayer', Clegg warns","925 words","The Independent - Daily Edition","NEWS; Pg. 7",
"By Tony Blair","October 29, 2016 Saturday 12:00 PM GMT",,"Tony Blair: If Brexit is a disaster we mush have right to change our mind; Writing in The New European, the former Prime Minister set out his treatise on combating Brexit","924 words","mirror.co.uk","NEWS,UK NEWS",
"Graham Ruddick","October 26, 2016 Wednesday 7:12 PM GMT",,"Goldman Sachs: in the headlines despite its renowned discretion; The leak of Theresa May's Brexit warning to Goldman staff won't go down well at an investment bank where secrecy is vital","921 words","The Guardian","BUSINESS",
"By Tara Cunningham, Business Reporter","October 27, 2016 Thursday 8:00 AM GMT",,"Pound hits one-week high after data shows UK economy grew by 0.5pc after Brexit vote","9206 words","telegraph.co.uk","BUSINESS",
,"October 26, 2016",,"Worrying uncertainty in talks; The Opinion Matrix COMMENT FROM HOME & ABROAD UK BREXIT TALKS","92 words","i-Independent Print Ltd","NEWS; Pg. 14",
"Reiss Smith","October 20, 2016 Thursday 4:13 PM GMT",,"Theresa May's first 100 days as Prime Minister: A timeline from Brexit vote to today","918 words","Express Online",,
"JAMES TAPSFIELD, POLITICAL EDITOR FOR MAILONLINE","October 21, 2016 Friday 1:07 PM GMT",,"Mais non! PM slaps down EU's Brexit chief after he signals he wants UK officials to speak FRENCH during negotiations","915 words","MailOnline","NEWS",
"JAMES TAPSFIELD, POLITICAL EDITOR FOR MAILONLINE","October 27, 2016 Thursday 9:26 AM GMT",,"So much for Project Fear! The UK economy GREW by 0.5% in the three months after historic Brexit vote despite Osborne's dire warnings","908 words","MailOnline","NEWS",
"David Hughes and Lucinda Cameron","October 23, 2016 Sunday 12:00 AM GMT",,"SNP calls for Theresa May to treat Scotland as 'equal partner' in Brexit negotiations","907 words","Express Online",,
"JAMES TAPSFIELD, POLITICAL EDITOR FOR MAILONLINE","October 21, 2016 Friday 10:33 AM GMT",,"PM faces more tough Brexit talks as EU leaders say doors MUST stay open to migrants if we want the single market and our former man in Brussels warns they are driven by 'emotion'","907 words","MailOnline","NEWS",
"Sean O'Grady","October 21, 2016 Friday 11:29 AM GMT",,"What would a Hillary Clinton victory mean for post-Brexit Britain?; Clinton has made no secret of her views on Brexit - she doesn't much like it, and she is likely to follow the line set by Obama that Britain will be ""at the back of the queue"" for a trade deal","905 words","The Independent (United Kingdom)","VOICES",
"Andrew Tickell","October 31, 2016 Monday",,"The academic talent are packing their bags; Brexit Britain's politics are alienating foreign scholars and will leave us 'intellectually and culturally impoverished'","903 words","The Times (London)","EDITORIAL; Pg. 25",
,"October 31, 2016 Monday",,"Hiring flat as recruiters digest Brexit vote's effect; BUSINESS BULLETIN","90 words","The Daily Telegraph (London)","BUSINESS; Pg. 4",
,"October 29, 2016",,"Myths corrode public trust; The Opinion Matrix COMMENT FROM HOME & ABROAD BREXIT PREDICTIONS","90 words","i-Independent Print Ltd","NEWS; Pg. 16",
,"October 24, 2016",,"May must unite the government; The Opinion Matrix COMMENT FROM HOME & ABROAD POST-BREXIT BRITAIN","90 words","i-Independent Print Ltd","NEWS; Pg. 12",
,"October 30, 2016 Sunday",,"HARD OR SOFT BREXIT?","9 words","The Sunday Times (London)","BUSINESS;BUSINESS; FRONT PAGE; TEASERS; Pg. 1",
"John Rentoul","October 22, 2016 Saturday 3:25 PM GMT",,"The EU has taken Brexit badly, but Theresa May will win in the end; The Prime Minister had a rough reception in Brussels, and it is going to get harder for her, but tough Brexit talks are not going to weaken her popularity at home","895 words","The Independent (United Kingdom)","VOICES",
"Sam Coates","October 21, 2016 Friday",,"Call early election before Brexit troubles mount, Tories tell May","893 words","The Times (London)","NEWS; Pg. 6,7",
"Matthew Norman","November 1, 2016 Tuesday 3:51 PM GMT",,"Mark Carney is the immigrant worker everyone wants to send home after Brexit - and good riddance to that negative Remoaner; This uncouth invader from the frozen north had the gall to bang on, as if it was any of his beeswax, about the economic implications of Brexit. But isn't that the old, old problem with people who come over here and nick our jobs? They don't understand our ways","892 words","The Independent (United Kingdom)","VOICES",
"DANIEL JOHNSON","October 23, 2016 Sunday",,"Germans gloat over Brexit pains to distract from trouble at home","889 words","The Sunday Times (London)","EDITORIAL; OPINION COLUMNS; Pg. 23",
"CHARLES CRAWFORD","October 30, 2016",,"This once great nation can be influential again; Over decades we destroyed our Foreign Office and its global work. Brexit means restoring it to former glory","887 words","The Sunday Telegraph (London)","LETTERS; Pg. 21",
"By Telegraph View","October 28, 2016 Friday 6:50 PM GMT",,"Tony Blair is a distrusted man who made Brexit possible","886 words","telegraph.co.uk","OPINION",
,"October 23, 2016 Sunday 10:01 PM GMT",,"'We just need to get OUT!' Suzanne Evans promises Brexit push if she wins Ukip leadership","881 words","Express Online",,
"Duncan Weldon","November 1, 2016 Tuesday 8:00 AM GMT",,"Dreaming of a 'single market-lite' for Britain? Time to wake up; For many, the ultimate result from Brexit would be free movement of goods and services, with restrictions on labour. That won't be on the table","880 words","The Guardian","OPINION",
"By Tom Harris","October 28, 2016 Friday 12:53 PM GMT",,"Tony Blair is my hero, but even he has no right to overturn our democratic vote for Brexit","880 words","telegraph.co.uk","NEWS",
,"October 20, 2016",,"What will become of the border?; The Opinion Matrix COMMENT FROM HOME & ABROAD IRELAND'S BREXIT","88 words","i-Independent Print Ltd","FEATURES; Pg. 14",
"William Keegan","October 30, 2016 Sunday 6:00 AM GMT",,"Brexit is a case our conflicted PM shouldn't have taken on; Theresa May should be true to her pre-referendum views - and put our departure from the EU to a parliamentary vote","877 words","The Observer (London)","WORLD NEWS",
"Graham Ruddick","October 26, 2016 Wednesday 7:31 PM GMT",,"Businesses are rightly frustrated with Theresa May's Brexit handling; PM revealed her true thoughts on leaving the EU in a private speech - GM and Morgan Stanley have shown they agree","877 words","The Guardian","POLITICS",
"Marc Horne","October 27, 2016 Thursday",,"EU diplomats praise Scotland as 'haven' in wake of Brexit","876 words","The Times (London)","NEWS; Pg. 5",
"Emma Sheppard","October 31, 2016 Monday 7:00 AM GMT",,"Shadow business minister: 'we have to stay in the single market'; Bill Esterson discusses Brexit fallout, the proposed small business commissioner role and his attempts to build regional support for entrepreneurs","875 words","The Guardian","GUARDIAN SMALL BUSINESS NETWORK",
"ALEX BRUMMER FOR THE DAILY MAIL","October 27, 2016 Thursday 6:22 PM GMT",,"ALEX BRUMMER: Brexit tonic for Barclay's as boss Jes Staley's instincts on investment banking prove correct","872 words","MailOnline","COMMENT",
"SHAUN CONNOLLY, Neil Lancefield","October 27, 2016 Thursday 9:35 PM GMT",,"Downing Street denies offering Nissan 'sweetheart deal' to overcome Brexit fears and expand Sunderland production; Ministers under pressure to reveal 'support and assurances'Government offered car manfacturer","871 words","The Independent (United Kingdom)","BUSINESS NEWS",
"Dan Roberts in Washington and Sabrina Siddiqui in Philadelphia","October 24, 2016 Monday 12:18 PM GMT",,"Trump camp admits uphill election battle as Clinton looks down-ballot; Trump campaign hopes swing-state tour offsets Clinton ad spending 'Brexit x5': can Republicans buck poll numbers for a surprise win?","870 words","The Guardian","US NEWS",
"JOHN RENTOUL","October 23, 2016 Sunday",,"EU has taken Brexit badly, but May will win in the end","870 words","The Independent - Daily Edition","COMMENT; Pg. 29",
"ALEX HAWKES FOR THE MAIL ON SUNDAY","October 29, 2016 Saturday 8:12 PM GMT",,"As the Bank of England rethinks post-Brexit GDP prospects, is Mark Carney on the brink of a shock exit?","868 words","MailOnline","NEWS",
"JAMES TAPSFIELD, POLITICAL EDITOR FOR MAILONLINE","October 27, 2016 Thursday 10:58 AM GMT",,"'A vote of confidence in post-Brexit Britain': Jubilant Theresa May hails Nissan decision to build new Qashqai and X-Trail models in Sunderland","867 words","MailOnline","NEWS",
"Joe Barnes","October 20, 2016 Thursday 12:01 AM GMT",,"Two years is NOT ENOUGH to negotiate Brexit trade deal, blasts Remoaner Hilary Benn","865 words","Express Online",,
"Nick Gutteridge","October 25, 2016 Tuesday 10:25 PM GMT",,"BREAKING NEWS: Leaked audio shows what Theresa May said about Brexit behind closed doors","864 words","Express Online",,
"BY ALEX BRUMMER","October 28, 2016 Friday",,"BREXIT TONIC FOR BANKERS","863 words","DAILY MAIL (London)",,
"Phillip Inman Economics correspondent","October 27, 2016 Thursday 7:55 PM GMT",,"UK economy shrugs off Brexit uncertainty with 0.5% growth; Best-performing major economy defies forecasts as services boom but business groups call for help to agriculture, construction and manufacturing","862 words","The Guardian","BUSINESS",
"By Asa Bennett","October 27, 2016 Thursday 11:06 AM GMT",,"A Stop Brexit party would never work. But politicians will still try to pander to those in 'Brenial'","862 words","telegraph.co.uk","NEWS",
"Rowena Mason Deputy political editor","October 30, 2016 Sunday 12:09 PM GMT",,"UK seeking tariff-free EU deal for carmakers, Nissan told; Business secretary Greg Clark sought to allay Brexit concerns and convince company to build next two models in Sunderland","859 words","The Guardian","BUSINESS",
"Rehema Figueiredo","October 26, 2016 Wednesday 7:58 AM GMT",,"'Brexit will make business LEAVE Britain': Angry backlash at Theresa May over leaked tapes","859 words","Express Online",,
"Will Worley","October 22, 2016 Saturday 3:48 PM GMT",,"Battle to save Canada trade deal with EU amid concerns over implications for Brexit; Negotiationscollapsed after the Belgian state of Wallonia refused to support the free trade pact - with the troubled deal highlighting how difficult Brexit talks could be","859 words","The Independent (United Kingdom)","EUROPE",
"Eamonn Forde","November 1, 2016 Tuesday 12:29 PM GMT",,"Why Brexit is not music to the ears of British bands touring Europe; In the wake of the EU referendum, British live music faces an uncertain future as visa and carnet costs could make playing shows across Europe unsustainable","854 words","The Guardian","MUSIC",
"Simon Nixon","October 20, 2016 Thursday",,"Simon Nixon; European Union believes it already has the upper hand in Brexit talks","854 words","The Times (London)","BUSINESS; Pg. 35",
"Tom Martin","October 31, 2016 Monday 12:10 AM GMT",,"Scottish Independence 'bigger threat to banking than Brexit'","853 words","Express Online",,
"THIS IS MONEY MARKET REPORTERS","October 27, 2016 Thursday 8:28 AM GMT",,"FTSE LIVE: Footsie weak ahead of first post-Brexit GDP data, although banks rally after Barclays beats forecasts","853 words","MailOnline","MARKETS",
,"October 26, 2016 Wednesday",,"Experts warn of £84bn Brexit blow","85 words","Daily Mirror","NEWS; Pg. 2",
"JACK BLANCHARD; DAVID CRAIK; MARK ELLIS","October 28, 2016 Friday",,"HERE WE GROW; BREXIT FEAR BRITAIN GETS BOOST UK economy expands 0.5% & shoppers hit the high street Nissan jobs pledge but food prices to rise","848 words","Daily Mirror","NEWS; Pg. 16,17",
"MATTHEW NORMAN","October 24, 2016 Monday",,"If the bankers leave London, it'll be lower-income Brexit voters who suffer most","847 words","The Independent - Daily Edition","COMMENT; Pg. 29",
"Macer Hall","October 31, 2016 Monday",,"EU EXIT TO SPARK UK TRADE BONANZA GET US OUT OF THE EU; But only if we ditch Brussels fast Countries 'queueing up' to trade with Brexit UK","846 words","The Express","NEWS; Pg. 1,4,5",
"Joe Watts","October 29, 2016 Saturday 11:03 PM GMT",,"Brexit: Theresa May urged to act fast as new poll finds huge support for protecting EU migrants' rights; Exclusive polling for The Independent reveals that 66 per cent want the Prime Minister to ensure Europeans living and working in the UK can stay on after Brexit","846 words","The Independent (United Kingdom)","UK POLITICS",
"Tom Martin","October 24, 2016 Monday 7:01 PM GMT",,"Theresa May and Nicola Sturgeon clash: PM warns First Minister against undermining Brexit","844 words","Express Online",,
"Nish Kumar","October 25, 2016 Tuesday 7:09 PM GMT",,"We are living in The West Wing written by Adam Sandler - no wonder we're looking to snack companies for sanity; First came the spokespeople of Skittles, then Tic Tacs and the king of crisps Gary Lineker. Who next? Talking M&M's on Brexit?","843 words","The Guardian","OPINION",
"ADAM LUSHER","October 24, 2016 Monday",,"Farage's referendum night concession 'made Brexit backers millions'","840 words","The Independent - Daily Edition","NEWS; Pg. 14",
"Greg Heffer, Political Reporter","October 25, 2016 Tuesday 6:00 PM GMT",,"UK expats must wait until END of Brexit talks to discover fate, French ambassador warns","838 words","Express Online",,
"Siobhan Fenton","October 25, 2016 Tuesday 12:49 PM GMT",,"Northern Ireland will suffer because of Brexit - but the mainland couldn't care less; The appearance of the EU as faceless bureaucracy may have angered many English voters, but was a notable benefit when it came to posing as a neutral force in Northern Ireland's complex community relations","837 words","The Independent (United Kingdom)","VOICES",
"James Moore","October 31, 2016 Monday 12:26 PM GMT",,"WPP boss Sir Martin Sorrell must be heeded on Brexit and Mark Carney; Sir Martin has pointed to a softening advertising market as an early sign of ""Brexit anxiety"". It could get worse if the Government ignores him and allows the Governor of the Bank of Englandto walk away","836 words","The Independent (United Kingdom)","BUSINESS COMMENT",
"David Runciman","October 31, 2016 Monday 9:00 AM GMT",,"Politics has gone wrong. Is digital technology to blame?; In the age of Brexit and Trump we shout at each other across a gulf of understanding, not thinking that machines rather than people could be at fault","834 words","The Guardian","OPINION",
"Macer Hall","October 27, 2016 Thursday 12:01 AM GMT",,"EU poll shows two-thirds of voters oppose migrants having preferential access after Brexit","830 words","Express Online",,
"Andrew Grice","October 22, 2016 Saturday 1:48 PM GMT",,"May has found out how much of a nightmare her Brexit talks are going to be; Some EU officials are already talking about a 'dirty Brexit', with no deal being reached during the two years of formal talks starting early next year","829 words","The Independent (United Kingdom)","VOICES",
"Ashley Cowburn","October 24, 2016 Monday 9:14 AM GMT",,"Brexit: Philip Hammond must honour £350m NHS pledge, MPs demand; The 41 MPs claim that 'anything else will be a betrayal of the wishes of the British people'","828 words","The Independent (United Kingdom)","UK POLITICS",
"MATT DATHAN, POLITICAL CORRESPONDENT FOR MAILONLINE","October 28, 2016 Friday 10:22 AM GMT",,"Ministers sent a last-ditch letter promising to protect Nissan from Brexit costs but face calls to reveal details of 'secret deal' that kept car maker in the UK","827 words","MailOnline","NEWS",
"SIOBHAN FENTON","October 26, 2016 Wednesday",,"Northern Ireland will suffer because of Brexit, but the mainland couldn't care less","827 words","The Independent - Daily Edition","COMMENT; Pg. 31",
"By Peter Dominiczak, Political Editor and Peter Foster , Europe Editor","October 21, 2016 Friday 6:16 AM GMT",,"EU leaders gang up on Theresa May over Brexitas she prepares for talks with Jean-Claude Juncker","821 words","telegraph.co.uk","NEWS",
"Peter Scott","November 1, 2016 Tuesday 5:45 AM GMT",,"The UK is becoming the nasty country, and our universities will suffer; Why would talented academics want a career in Brexit-voting Britain, where a handful of refugee children provoke a tabloid firestorm?","820 words","The Guardian","EDUCATION",
"By Sir David Greenaway","October 21, 2016 Friday 11:01 PM GMT",,"Brexit might be the catalyst we've been waiting for","820 words","telegraph.co.uk","EDUCATION",
"Kalyeena Makortoff","October 28, 2016",,"EasyJet boss confident of post-Brexit deal; AIR TRAVEL","82 words","i-Independent Print Ltd","NEWS; Pg. 4",
"Chitra Ramaswamy","October 24, 2016 Monday 3:47 PM GMT",,"The great Brexit text mess: how Boris, Gove and co waged war by phone; Many of the extraordinary political machinations that followed the Brexit vote were reportedly organised - or scuppered - by text. Here are some of the key missives","813 words","The Guardian","POLITICS",
,"October 30, 2016 Sunday",,"Buoyant Belfast office lettings shrug off the post-Brexit blues","810 words","The Sunday Times (London)","BUSINESS; Pg. 12",
"Alix Culbertson","November 1, 2016 Tuesday 12:00 AM GMT",,"BREXIT BOOM: British luxury watch industry sees sales rocket by 70 per cent","807 words","Express Online",,
"Joe Watts and Rob Merrick","October 22, 2016 Saturday 12:54 AM GMT",,"Theresa May faces Brexit battles on two fronts after being sidelined at EU summit; Asked what he made of British Prime Minister's performance at her first EU summit,Commission President Jean Claude Juncker says 'pfff'","805 words","The Independent (United Kingdom)","UK POLITICS",
"Julia Kollewe and Jessica Elgot","October 27, 2016 Thursday 2:01 PM GMT",,"Nissan to make new car models in UK as economy defies Brexit fears; Carmaker announces major investment in Sunderland factory after confirming government support","804 words","The Guardian","BUSINESS",
,"October 25, 2016 Tuesday",,"Vote warning in Brexit talks","80 words","Daily Mirror","NEWS; Pg. 9",
